import time, unittest, datetime
from cytimes import errors


class TestCase(unittest.TestCase):
    name: str = "Case"

    def test_all(self) -> None:
        pass

    # Utils
    def log_start(self, msg: str) -> None:
        msg = "START TEST '%s': %s" % (self.name, msg)
        print(msg.ljust(60), end="\r")
        self._start_time = time.perf_counter()

    def log_ended(self, msg: str, skip: bool = False) -> None:
        self._ended_time = time.perf_counter()
        msg = "%s TEST '%s': %s" % ("SKIP" if skip else "PASS", self.name, msg)
        if self._start_time is not None:
            msg += " (%.6fs)" % (self._ended_time - self._start_time)
        print(msg.ljust(60))


class TestParser(TestCase):
    name = "Parser"
    dts: list[tuple[str, str, str]] = [
        # fmt: off
        ('  July   4 ,  1976   12:01:02   am  ', '1976-07-04 00:01:02', '1976-07-04 00:01:02'),
        ('0003-03-04', '0003-03-04 00:00:00', '0003-03-04 00:00:00'),
        ('0031-02-02T01:01:01', '0031-02-02 01:01:01', '0031-02-02 01:01:01'),
        ('0099-02-02T01:01:01', '0099-02-02 01:01:01', '0099-02-02 01:01:01'),
        ('00:11:25.02', '0001-01-01 00:11:25.020000', '0001-01-01 00:11:25.020000'),
        ('01h02', '0001-01-01 01:02:00', '0001-01-01 01:02:00'),
        ('01h02m03', '0001-01-01 01:02:03', '0001-01-01 01:02:03'),
        ('01h02s', '0001-01-01 01:00:02', '0001-01-01 01:00:02'),
        ('01m02', '0001-01-01 00:01:02', '0001-01-01 00:01:02'),
        ('01m02h', '0001-01-01 02:01:00', '0001-01-01 02:01:00'),
        ('02 08 2023', '2023-02-08 00:00:00', '2023-02-08 00:00:00'),
        ('02 08 2023 12:01', '2023-02-08 12:01:00', '2023-02-08 12:01:00'),
        ('02 08 2023 12:01:01', '2023-02-08 12:01:01', '2023-02-08 12:01:01'),
        ('02 8 2023', '2023-02-08 00:00:00', '2023-02-08 00:00:00'),
        ('02 8 2023 12:01', '2023-02-08 12:01:00', '2023-02-08 12:01:00'),
        ('02 8 2023 12:01:01', '2023-02-08 12:01:01', '2023-02-08 12:01:01'),
        ('02 Ağustos 2023 12:01', '2023-08-02 12:01:00', '2023-08-02 12:01:00'),
        ('02 de agosto de 2023', '2023-08-02 00:00:00', '2023-08-02 00:00:00'),
        ('02-08-2023 12:01 Uhr', '2023-02-08 12:01:00', '2023-02-08 12:01:00'),
        ('02-08-23', '2023-02-08 00:00:00', '2023-02-08 00:00:00'),
        ('02-Aug-2023', '2023-08-02 00:00:00', '2023-08-02 00:00:00'),
        ('02-Aug-2023 12:01 AM', '2023-08-02 00:01:00', '2023-08-02 00:01:00'),
        ('02-Aug-2023 12:01 PM', '2023-08-02 12:01:00', '2023-08-02 12:01:00'),
        ('02-August-2023 12:01', '2023-08-02 12:01:00', '2023-08-02 12:01:00'),
        ('02-August-2023 12:01 AM', '2023-08-02 00:01:00', '2023-08-02 00:01:00'),
        ('02-August-2023 12:01 PM', '2023-08-02 12:01:00', '2023-08-02 12:01:00'),
        ('02-August-23', '2023-08-02 00:00:00', '2023-08-02 00:00:00'),
        ('02. August 2023', '2023-08-02 00:00:00', '2023-08-02 00:00:00'),
        ('02.08.2023', '2023-02-08 00:00:00', '2023-02-08 00:00:00'),
        ('02/08/2023', '2023-02-08 00:00:00', '2023-02-08 00:00:00'),
        ('02/08/2023 01:01:01', '2023-02-08 01:01:01', '2023-02-08 01:01:01'),
        ('02/08/2023 12:01', '2023-02-08 12:01:00', '2023-02-08 12:01:00'),
        ('02/08/2023 12:01 AM', '2023-02-08 00:01:00', '2023-02-08 00:01:00'),
        ('02/08/2023 12:01 PM', '2023-02-08 12:01:00', '2023-02-08 12:01:00'),
        ('02/08/2023 12:01:01', '2023-02-08 12:01:01', '2023-02-08 12:01:01'),
        ('02/08/23', '2023-02-08 00:00:00', '2023-02-08 00:00:00'),
        ('02:12:10.02', '0001-01-01 02:12:10.020000', '0001-01-01 02:12:10.020000'),
        ('02:17NOV2017', '2017-11-01 02:17:00', '2017-11-01 02:17:00'),
        ('03 25 Sep', '2003-09-25 00:00:00', '2003-09-25 00:00:00'),
        ('04.04.95 01:22', '1995-04-04 01:22:00', '1995-04-04 01:22:00'),
        ('08 02 2023', '2023-08-02 00:00:00', '2023-08-02 00:00:00'),
        ('08 02 2023 12:01', '2023-08-02 12:01:00', '2023-08-02 12:01:00'),
        ('08 02 2023 12:01:01', '2023-08-02 12:01:01', '2023-08-02 12:01:01'),
        ('08 2 2023', '2023-08-02 00:00:00', '2023-08-02 00:00:00'),
        ('08 2 2023 12:01', '2023-08-02 12:01:00', '2023-08-02 12:01:00'),
        ('08 2 2023 12:01:01', '2023-08-02 12:01:01', '2023-08-02 12:01:01'),
        ('08-02-2023', '2023-08-02 00:00:00', '2023-08-02 00:00:00'),
        ('08-02-2023 01:01 AM', '2023-08-02 01:01:00', '2023-08-02 01:01:00'),
        ('08-02-2023 01:01 PM', '2023-08-02 13:01:00', '2023-08-02 13:01:00'),
        ('08-02-2023 01:01:01', '2023-08-02 01:01:01', '2023-08-02 01:01:01'),
        ('08-02-2023 12:01', '2023-08-02 12:01:00', '2023-08-02 12:01:00'),
        ('08-02-2023 12:01 AM', '2023-08-02 00:01:00', '2023-08-02 00:01:00'),
        ('08-02-2023 12:01 PM', '2023-08-02 12:01:00', '2023-08-02 12:01:00'),
        ('08-02-2023 12:01:01', '2023-08-02 12:01:01', '2023-08-02 12:01:01'),
        ('08/02/2023 12:01', '2023-08-02 12:01:00', '2023-08-02 12:01:00'),
        ('08/02/2023 12:01 PM', '2023-08-02 12:01:00', '2023-08-02 12:01:00'),
        ('09 25 2003', '2003-09-25 00:00:00', '2003-09-25 00:00:00'),
        ('09-25-2003', '2003-09-25 00:00:00', '2003-09-25 00:00:00'),
        ('09.25.2003', '2003-09-25 00:00:00', '2003-09-25 00:00:00'),
        ('09/25/2003', '2003-09-25 00:00:00', '2003-09-25 00:00:00'),
        ('090207', '2007-09-02 00:00:00', '2007-09-02 00:00:00'),
        ('10 09 03', '2003-10-09 00:00:00', '2003-10-09 00:00:00'),
        ('10 09 2003', '2003-10-09 00:00:00', '2003-10-09 00:00:00'),
        ('10-09-03', '2003-10-09 00:00:00', '2003-10-09 00:00:00'),
        ('10-09-2003', '2003-10-09 00:00:00', '2003-10-09 00:00:00'),
        ('10.09.03', '2003-10-09 00:00:00', '2003-10-09 00:00:00'),
        ('10.09.2003', '2003-10-09 00:00:00', '2003-10-09 00:00:00'),
        ('10/09/03', '2003-10-09 00:00:00', '2003-10-09 00:00:00'),
        ('10/09/2003', '2003-10-09 00:00:00', '2003-10-09 00:00:00'),
        ('10:01 am', '0001-01-01 10:01:00', '0001-01-01 10:01:00'),
        ('10:01 pm', '0001-01-01 22:01:00', '0001-01-01 22:01:00'),
        ('10:01a.m', '0001-01-01 10:01:00', '0001-01-01 10:01:00'),
        ('10:01a.m.', '0001-01-01 10:01:00', '0001-01-01 10:01:00'),
        ('10:01am', '0001-01-01 10:01:00', '0001-01-01 10:01:00'),
        ('10:01p.m', '0001-01-01 22:01:00', '0001-01-01 22:01:00'),
        ('10:01p.m.', '0001-01-01 22:01:00', '0001-01-01 22:01:00'),
        ('10:01pm', '0001-01-01 22:01:00', '0001-01-01 22:01:00'),
        ('10:36', '0001-01-01 10:36:00', '0001-01-01 10:36:00'),
        ('10:36:28', '0001-01-01 10:36:28', '0001-01-01 10:36:28'),
        ('10am', '0001-01-01 10:00:00', '0001-01-01 10:00:00'),
        ('10h', '0001-01-01 10:00:00', '0001-01-01 10:00:00'),
        ('10h am', '0001-01-01 10:00:00', '0001-01-01 10:00:00'),
        ('10h pm', '0001-01-01 22:00:00', '0001-01-01 22:00:00'),
        ('10h36', '0001-01-01 10:36:00', '0001-01-01 10:36:00'),
        ('10h36.5', '0001-01-01 10:36:30', '0001-01-01 10:36:30'),
        ('10h36m', '0001-01-01 10:36:00', '0001-01-01 10:36:00'),
        ('10h36m28.5s', '0001-01-01 10:36:28.500000', '0001-01-01 10:36:28.500000'),
        ('10h36m28s', '0001-01-01 10:36:28', '0001-01-01 10:36:28'),
        ('10pm', '0001-01-01 22:00:00', '0001-01-01 22:00:00'),
        ('11 AM PM', '0001-01-01 23:00:00', '0001-01-01 23:00:00'),
        ('11 PM', '0001-01-01 23:00:00', '0001-01-01 23:00:00'),
        ('11pm', '0001-01-01 23:00:00', '0001-01-01 23:00:00'),
        ('12 AM 2023-08-02', '2023-08-02 00:00:00', '2023-08-02 00:00:00'),
        ('12 AM August 2, 2023', '2023-08-02 00:00:00', '2023-08-02 00:00:00'),
        ('12 PM 2023-08-02', '2023-08-02 12:00:00', '2023-08-02 12:00:00'),
        ('12 PM August 2, 2023 AKDT', '2023-08-02 12:00:00', '2023-08-02 12:00:00-08:00'),
        ('12 PM August 2, 2023 AKST', '2023-08-02 12:00:00', '2023-08-02 12:00:00-09:00'),
        ('12 PM August 2, 2023 EST', '2023-08-02 12:00:00', '2023-08-02 12:00:00-05:00'),
        ('12 PM August 2, 2023 GMT', '2023-08-02 12:00:00', '2023-08-02 12:00:00+00:00'),
        ('12 PM August 2, 2023 HST', '2023-08-02 12:00:00', '2023-08-02 12:00:00-10:00'),
        ('12 PM August 2, 2023 MST', '2023-08-02 12:00:00', '2023-08-02 12:00:00-07:00'),
        ('12 PM August 2, 2023 PST', '2023-08-02 12:00:00', '2023-08-02 12:00:00-08:00'),
        ('12 PM August 2, 2023 UTC', '2023-08-02 12:00:00', '2023-08-02 12:00:00+00:00'),
        ('12 PM on August 2, 2023', '2023-08-02 12:00:00', '2023-08-02 12:00:00'),
        ('12, 1952 AD 3:30:42pm', '1952-12-01 15:30:42', '1952-12-01 15:30:42'),
        ('125959.123', '0001-01-01 12:59:59.123000', '0001-01-01 12:59:59.123000'),
        ('12:01 am August 2, 2023', '2023-08-02 00:01:00', '2023-08-02 00:01:00'),
        ('12:01 pm August 2, 2023', '2023-08-02 12:01:00', '2023-08-02 12:01:00'),
        ('12:08 PM', '0001-01-01 12:08:00', '0001-01-01 12:08:00'),
        ('12:32', '0001-01-01 12:32:00', '0001-01-01 12:32:00'),
        ('12:32:53', '0001-01-01 12:32:53', '0001-01-01 12:32:53'),
        ('12:32:53.122', '0001-01-01 12:32:53.122000', '0001-01-01 12:32:53.122000'),
        ('12am August 2, 2023', '2023-08-02 00:00:00', '2023-08-02 00:00:00'),
        ('12h 01m02s am', '0001-01-01 00:01:02', '0001-01-01 00:01:02'),
        ('12h 2023-08-02', '2023-08-02 12:00:00', '2023-08-02 12:00:00'),
        ('12h on August 2, 2023', '2023-08-02 12:00:00', '2023-08-02 12:00:00'),
        ('12h01m 2023-08-02', '2023-08-02 12:01:00', '2023-08-02 12:01:00'),
        ('12h01m on August 2, 2023', '2023-08-02 12:01:00', '2023-08-02 12:01:00'),
        ('12h01m01s on August 2, 2023', '2023-08-02 12:01:01', '2023-08-02 12:01:01'),
        ('12h32m53', '0001-01-01 12:32:53', '0001-01-01 12:32:53'),
        ('12pm August 2, 2023', '2023-08-02 12:00:00', '2023-08-02 12:00:00'),
        ('13NOV2017', '2017-11-13 00:00:00', '2017-11-13 00:00:00'),
        ('1976-07-04T01:02:03Z', '1976-07-04 01:02:03', '1976-07-04 01:02:03+00:00'),
        ('19760704', '1976-07-04 00:00:00', '1976-07-04 00:00:00'),
        ('1986-07-05T08:15:30z', '1986-07-05 08:15:30', '1986-07-05 08:15:30+00:00'),
        ('1994-11-05T08:15:30-05:00', '1994-11-05 08:15:30', '1994-11-05 08:15:30-05:00'),
        ('1994-11-05T08:15:30Z', '1994-11-05 08:15:30', '1994-11-05 08:15:30+00:00'),
        ('1996.07.10 AD at 15:08:56', '1996-07-10 15:08:56', '1996-07-10 15:08:56'),
        ('1996.July.10 AD 12:08 PM', '1996-07-10 12:08:00', '1996-07-10 12:08:00'),
        ('199709020908', '1997-09-02 09:08:00', '1997-09-02 09:08:00'),
        ('19970902090807', '1997-09-02 09:08:07', '1997-09-02 09:08:07'),
        ('19990802T2359', '1999-08-02 23:59:00', '1999-08-02 23:59:00'),
        ('19990802T235959', '1999-08-02 23:59:59', '1999-08-02 23:59:59'),
        ('19990802T235959.123', '1999-08-02 23:59:59.123000', '1999-08-02 23:59:59.123000'),
        ('1:01 PM', '0001-01-01 13:01:00', '0001-01-01 13:01:00'),
        ('1:01:02', '0001-01-01 01:01:02', '0001-01-01 01:01:02'),
        ('1:01:02 on July 4, 1976', '1976-07-04 01:01:02', '1976-07-04 01:01:02'),
        ('2 08 2023', '2023-02-08 00:00:00', '2023-02-08 00:00:00'),
        ('2 08 2023 12:01', '2023-02-08 12:01:00', '2023-02-08 12:01:00'),
        ('2 08 2023 12:01:01', '2023-02-08 12:01:01', '2023-02-08 12:01:01'),
        ('2 8 2023', '2023-02-08 00:00:00', '2023-02-08 00:00:00'),
        ('2 8 2023 12:01', '2023-02-08 12:01:00', '2023-02-08 12:01:00'),
        ('2 8 2023 12:01:01', '2023-02-08 12:01:01', '2023-02-08 12:01:01'),
        ('2 Aug 2023 12:01:01 +0530', '2023-08-02 12:01:01', '2023-08-02 12:01:01+05:30'),
        ('2 Aug 2023 12:01:01 +05:30', '2023-08-02 12:01:01', '2023-08-02 12:01:01+05:30'),
        ('2 Aug 2023 12:01:01 -0500', '2023-08-02 12:01:01', '2023-08-02 12:01:01-05:00'),
        ('2 Aug 2023 12:01:01 -05:00', '2023-08-02 12:01:01', '2023-08-02 12:01:01-05:00'),
        ('2 Aug, 2023', '2023-08-02 00:00:00', '2023-08-02 00:00:00'),
        ('2 Aug, 2023 01:01:01', '2023-08-02 01:01:01', '2023-08-02 01:01:01'),
        ('2 Aug, 2023 12:01 AM', '2023-08-02 00:01:00', '2023-08-02 00:01:00'),
        ('2 Aug, 2023 12:01 PM', '2023-08-02 12:01:00', '2023-08-02 12:01:00'),
        ('2 Aug, 2023 12:01:01', '2023-08-02 12:01:01', '2023-08-02 12:01:01'),
        ('2 August 2023 12:01 PM', '2023-08-02 12:01:00', '2023-08-02 12:01:00'),
        ('2 August 2023 at 12 AM', '2023-08-02 00:00:00', '2023-08-02 00:00:00'),
        ('2 August 2023 at 12 PM', '2023-08-02 12:00:00', '2023-08-02 12:00:00'),
        ('2 August 2023 at 12:01 PM GMT', '2023-08-02 12:01:00', '2023-08-02 12:01:00+00:00'),
        ('2 August 2023, 12:01 PM', '2023-08-02 12:01:00', '2023-08-02 12:01:00'),
        ('2 August, 2023', '2023-08-02 00:00:00', '2023-08-02 00:00:00'),
        ('2 August, 2023 01:01:01', '2023-08-02 01:01:01', '2023-08-02 01:01:01'),
        ('2 August, 2023 12:01 AM', '2023-08-02 00:01:00', '2023-08-02 00:01:00'),
        ('2 August, 2023 12:01 PM', '2023-08-02 12:01:00', '2023-08-02 12:01:00'),
        ('2 August, 2023 12:01:01', '2023-08-02 12:01:01', '2023-08-02 12:01:01'),
        ('2 Ağustos 2023 saat 12:01', '2023-08-02 12:01:00', '2023-08-02 12:01:00'),
        ('2 agosto 2023 ore 12:01', '2023-08-02 12:01:00', '2023-08-02 12:01:00'),
        ('2 de agosto de 2023', '2023-08-02 00:00:00', '2023-08-02 00:00:00'),
        ('2 de agosto de 2023 a las 12:01', '2023-08-02 12:01:00', '2023-08-02 12:01:00'),
        ('2 Αυγούστου 2023, 12:01', '2023-02-01 12:01:00', '2023-02-01 12:01:00'),
        ('2 августа 2023 г. в 12:01', '2023-02-01 12:01:00', '2023-02-01 12:01:00'),
        ('2 अगस्त 2023, 12:01 अपराह्न', '2023-02-01 12:01:00', '2023-02-01 12:01:00'),
        ('2-Aug-2023 12:01', '2023-08-02 12:01:00', '2023-08-02 12:01:00'),
        ('2-Aug-2023 12:01 AM', '2023-08-02 00:01:00', '2023-08-02 00:01:00'),
        ('2-Aug-2023 12:01 PM', '2023-08-02 12:01:00', '2023-08-02 12:01:00'),
        ('2-Aug-23', '2023-08-02 00:00:00', '2023-08-02 00:00:00'),
        ('2-August-2023 12:01', '2023-08-02 12:01:00', '2023-08-02 12:01:00'),
        ('2-August-2023 12:01 AM', '2023-08-02 00:01:00', '2023-08-02 00:01:00'),
        ('2-August-2023 12:01 PM', '2023-08-02 12:01:00', '2023-08-02 12:01:00'),
        ('2-August-23', '2023-08-02 00:00:00', '2023-08-02 00:00:00'),
        ('2. August 2023', '2023-08-02 00:00:00', '2023-08-02 00:00:00'),
        ('2. August 2023 um 12:01 Uhr', '2023-08-02 12:01:00', '2023-08-02 12:01:00'),
        ('2.8.2023 12:01', '2023-02-08 12:01:00', '2023-02-08 12:01:00'),
        ('2/8/2023 12:01', '2023-02-08 12:01:00', '2023-02-08 12:01:00'),
        ('2003', '2003-01-01 00:00:00', '2003-01-01 00:00:00'),
        ('2003 09 25', '2003-09-25 00:00:00', '2003-09-25 00:00:00'),
        ('2003 Sep 25', '2003-09-25 00:00:00', '2003-09-25 00:00:00'),
        ('2003-09-25', '2003-09-25 00:00:00', '2003-09-25 00:00:00'),
        ('2003-09-25 10:49:41,502', '2003-09-25 10:49:41.502000', '2003-09-25 10:49:41.502000'),
        ('2003-09-25T10', '2003-09-25 10:00:00', '2003-09-25 10:00:00'),
        ('2003-09-25T10:49', '2003-09-25 10:49:00', '2003-09-25 10:49:00'),
        ('2003-09-25T10:49:41', '2003-09-25 10:49:41', '2003-09-25 10:49:41'),
        ('2003-09-25T10:49:41 -0300', '2003-09-25 10:49:41', '2003-09-25 10:49:41-03:00'),
        ('2003-09-25T10:49:41 -03:00', '2003-09-25 10:49:41', '2003-09-25 10:49:41-03:00'),
        ('2003-09-25T10:49:41-03:00', '2003-09-25 10:49:41', '2003-09-25 10:49:41-03:00'),
        ('2003-09-25T10:49:41.5-03:00', '2003-09-25 10:49:41.500000', '2003-09-25 10:49:41.500000-03:00'),
        ('2003-Sep-25', '2003-09-25 00:00:00', '2003-09-25 00:00:00'),
        ('2003.09.25', '2003-09-25 00:00:00', '2003-09-25 00:00:00'),
        ('2003.Sep.25', '2003-09-25 00:00:00', '2003-09-25 00:00:00'),
        ('2003/09/25', '2003-09-25 00:00:00', '2003-09-25 00:00:00'),
        ('2003/Sep/25', '2003-09-25 00:00:00', '2003-09-25 00:00:00'),
        ('20030925', '2003-09-25 00:00:00', '2003-09-25 00:00:00'),
        ('20030925T10', '2003-09-25 10:00:00', '2003-09-25 10:00:00'),
        ('20030925T1049', '2003-09-25 10:49:00', '2003-09-25 10:49:00'),
        ('20030925T104941', '2003-09-25 10:49:41', '2003-09-25 10:49:41'),
        ('20030925T104941-0300', '2003-09-25 10:49:41', '2003-09-25 10:49:41-03:00'),
        ('20030925T104941.5-0300', '2003-09-25 10:49:41.500000', '2003-09-25 10:49:41.500000-03:00'),
        ('2004 10 Apr 11h30m', '2004-04-10 11:30:00', '2004-04-10 11:30:00'),
        ('20080227T21:26:01.123456789', '2008-02-27 21:26:01.123456', '2008-02-27 21:26:01.123456'),
        ('2014 January 19', '2014-01-19 00:00:00', '2014-01-19 00:00:00'),
        ('2014 January 19 09:00 UTC', '2014-01-19 09:00:00', '2014-01-19 09:00:00+00:00'),
        ('2014-05-01 08:01:01', '2014-05-01 08:01:01', '2014-05-01 08:01:01'),
        ('2015 09 25', '2015-09-25 00:00:00', '2015-09-25 00:00:00'),
        ('2015-15-May', '2015-05-15 00:00:00', '2015-05-15 00:00:00'),
        ('2016-12-21 04.2h', '2016-12-21 04:12:00', '2016-12-21 04:12:00'),
        ('2017-02-03 12:40 BRST', '2017-02-03 12:40:00', '2017-02-03 12:40:00'),
        ('2017-07-17 06:15:', '2017-07-17 06:15:00', '2017-07-17 06:15:00'),
        ('2023 08 02 12', '2023-08-02 12:00:00', '2023-08-02 12:00:00'),
        ('2023 08 02 1201', '2023-08-02 12:01:00', '2023-08-02 12:01:00'),
        ('2023 08 02 120101', '2023-08-02 12:01:01', '2023-08-02 12:01:01'),
        ('2023 08 02 12:01', '2023-08-02 12:01:00', '2023-08-02 12:01:00'),
        ('2023 08 02 12:01:01', '2023-08-02 12:01:01', '2023-08-02 12:01:01'),
        ('2023 Aug 02', '2023-08-02 00:00:00', '2023-08-02 00:00:00'),
        ('2023 Aug-02', '2023-08-02 00:00:00', '2023-08-02 00:00:00'),
        ('2023 August 2st 12:01 AM', '2023-08-02 00:01:00', '2023-08-02 00:01:00'),
        ('2023 August 2st 12:01 PM', '2023-08-02 12:01:00', '2023-08-02 12:01:00'),
        ('2023 August-02', '2023-08-02 00:00:00', '2023-08-02 00:00:00'),
        ('2023-08-02', '2023-08-02 00:00:00', '2023-08-02 00:00:00'),
        ('2023-08-02 01:01', '2023-08-02 01:01:00', '2023-08-02 01:01:00'),
        ('2023-08-02 01:01 AM', '2023-08-02 01:01:00', '2023-08-02 01:01:00'),
        ('2023-08-02 01:01 PM', '2023-08-02 13:01:00', '2023-08-02 13:01:00'),
        ('2023-08-02 01:01:01', '2023-08-02 01:01:01', '2023-08-02 01:01:01'),
        ('2023-08-02 01:01:01 AM', '2023-08-02 01:01:01', '2023-08-02 01:01:01'),
        ('2023-08-02 01:01:01 PM', '2023-08-02 13:01:01', '2023-08-02 13:01:01'),
        ('2023-08-02 01:01:01 GMT', '2023-08-02 01:01:01', '2023-08-02 01:01:01+00:00'),
        ('2023-08-02 01:01:01 UTC', '2023-08-02 01:01:01', '2023-08-02 01:01:01+00:00'),
        ('2023-08-02 01:01:01+01:01', '2023-08-02 01:01:01', '2023-08-02 01:01:01+01:01'),
        ('2023-08-02 01:01:01+01:01 AM', '2023-08-02 01:01:01', '2023-08-02 01:01:01+01:01'),
        ('2023-08-02 01:01:01+01:01 PM', '2023-08-02 13:01:01', '2023-08-02 13:01:01+01:01'),
        ('2023-08-02 01:01:01-01:01', '2023-08-02 01:01:01', '2023-08-02 01:01:01-01:01'),
        ('2023-08-02 01:01:01-01:01 AM', '2023-08-02 01:01:01', '2023-08-02 01:01:01-01:01'),
        ('2023-08-02 01:01:01-01:01 PM', '2023-08-02 13:01:01', '2023-08-02 13:01:01-01:01'),
        ('2023-08-02 01:01:01.001001', '2023-08-02 01:01:01.001001', '2023-08-02 01:01:01.001001'),
        ('2023-08-02 01:01:01.001001+01:01', '2023-08-02 01:01:01.001001', '2023-08-02 01:01:01.001001+01:01'),
        ('2023-08-02 01:01:01.001001-01:01', '2023-08-02 01:01:01.001001', '2023-08-02 01:01:01.001001-01:01'),
        ('2023-08-02 01:01:01.001001Z', '2023-08-02 01:01:01.001001', '2023-08-02 01:01:01.001001+00:00'),
        ('2023-08-02 01:01:01.001Z', '2023-08-02 01:01:01.001000', '2023-08-02 01:01:01.001000+00:00'),
        ('2023-08-02 01:01:01.001Z AM', '2023-08-02 01:01:01.001000', '2023-08-02 01:01:01.001000+00:00'),
        ('2023-08-02 01:01:01.001Z PM', '2023-08-02 13:01:01.001000', '2023-08-02 13:01:01.001000+00:00'),
        ('2023-08-02 1 AM', '2023-08-02 01:00:00', '2023-08-02 01:00:00'),
        ('2023-08-02 1 PM', '2023-08-02 13:00:00', '2023-08-02 13:00:00'),
        ('2023-08-02 12', '2023-08-02 12:00:00', '2023-08-02 12:00:00'),
        ('2023-08-02 12 A.M.', '2023-08-02 00:00:00', '2023-08-02 00:00:00'),
        ('2023-08-02 12 P.M.', '2023-08-02 12:00:00', '2023-08-02 12:00:00'),
        ('2023-08-02 12 PM', '2023-08-02 12:00:00', '2023-08-02 12:00:00'),
        ('2023-08-02 12 am', '2023-08-02 00:00:00', '2023-08-02 00:00:00'),
        ("2023-08-02 12 o'clock AM", '2023-08-02 00:00:00', '2023-08-02 00:00:00'),
        ("2023-08-02 12 o'clock PM", '2023-08-02 12:00:00', '2023-08-02 12:00:00'),
        ('2023-08-02 12+01:01', '2023-08-02 12:00:00', '2023-08-02 12:00:00+01:01'),
        ('2023-08-02 12+05:30', '2023-08-02 12:00:00', '2023-08-02 12:00:00+05:30'),
        ('2023-08-02 12-01:01', '2023-08-02 12:00:00', '2023-08-02 12:00:00-01:01'),
        ('2023-08-02 12-05:30', '2023-08-02 12:00:00', '2023-08-02 12:00:00-05:30'),
        ('2023-08-02 1201+01:01', '2023-08-02 12:01:00', '2023-08-02 12:01:00+01:01'),
        ('2023-08-02 1201+05:30', '2023-08-02 12:01:00', '2023-08-02 12:01:00+05:30'),
        ('2023-08-02 1201-01:01', '2023-08-02 12:01:00', '2023-08-02 12:01:00-01:01'),
        ('2023-08-02 1201-05:30', '2023-08-02 12:01:00', '2023-08-02 12:01:00-05:30'),
        ('2023-08-02 120101+01:01', '2023-08-02 12:01:01', '2023-08-02 12:01:01+01:01'),
        ('2023-08-02 120101+05:30', '2023-08-02 12:01:01', '2023-08-02 12:01:01+05:30'),
        ('2023-08-02 120101-01:01', '2023-08-02 12:01:01', '2023-08-02 12:01:01-01:01'),
        ('2023-08-02 120101-05:30', '2023-08-02 12:01:01', '2023-08-02 12:01:01-05:30'),
        ('2023-08-02 120101Z', '2023-08-02 12:01:01', '2023-08-02 12:01:01+00:00'),
        ('2023-08-02 1201Z', '2023-08-02 12:01:00', '2023-08-02 12:01:00+00:00'),
        ('2023-08-02 12:01', '2023-08-02 12:01:00', '2023-08-02 12:01:00'),
        ('2023-08-02 12:01 AM', '2023-08-02 00:01:00', '2023-08-02 00:01:00'),
        ('2023-08-02 12:01 AM GMT', '2023-08-02 00:01:00', '2023-08-02 00:01:00+00:00'),
        ('2023-08-02 12:01 PM', '2023-08-02 12:01:00', '2023-08-02 12:01:00'),
        ('2023-08-02 12:01 PM +0000', '2023-08-02 12:01:00', '2023-08-02 12:01:00+00:00'),
        ('2023-08-02 12:01 PM -0500', '2023-08-02 12:01:00', '2023-08-02 12:01:00-05:00'),
        ('2023-08-02 12:01 PM GMT', '2023-08-02 12:01:00', '2023-08-02 12:01:00+00:00'),
        ('2023-08-02 12:01 PM UTC', '2023-08-02 12:01:00', '2023-08-02 12:01:00+00:00'),
        ('2023-08-02 12:01:01Z', '2023-08-02 12:01:01', '2023-08-02 12:01:01+00:00'),
        ('2023-08-02 12:01:01', '2023-08-02 12:01:01', '2023-08-02 12:01:01'),
        ('2023-08-02 12:01:01 -0300 (BRST)', '2023-08-02 12:01:01', '2023-08-02 12:01:01-03:00'),
        ('2023-08-02 12:01:01 123456789', '2023-08-02 12:01:01', '2023-08-02 12:01:01'),
        ('2023-08-02 12:01:01 123456789Z', '2023-08-02 12:01:01', '2023-08-02 12:01:01+00:00'),
        ('2023-08-02 12:01:01 AKDT', '2023-08-02 12:01:01', '2023-08-02 12:01:01-08:00'),
        ('2023-08-02 12:01:01 AKST', '2023-08-02 12:01:01', '2023-08-02 12:01:01-09:00'),
        ('2023-08-02 12:01:01 AM', '2023-08-02 00:01:01', '2023-08-02 00:01:01'),
        ('2023-08-02 12:01:01 AM GMT', '2023-08-02 00:01:01', '2023-08-02 00:01:01+00:00'),
        ('2023-08-02 12:01:01 CDT', '2023-08-02 12:01:01', '2023-08-02 12:01:01-05:00'),
        ('2023-08-02 12:01:01 EDT', '2023-08-02 12:01:01', '2023-08-02 12:01:01-04:00'),
        ('2023-08-02 12:01:01 EST', '2023-08-02 12:01:01', '2023-08-02 12:01:01-05:00'),
        ('2023-08-02 12:01:01 GMT', '2023-08-02 12:01:01', '2023-08-02 12:01:01+00:00'),
        ('2023-08-02 12:01:01 GMT-2', '2023-08-02 12:01:01', '2023-08-02 12:01:01+02:00'),
        ('2023-08-02 12:01:01 HST', '2023-08-02 12:01:01', '2023-08-02 12:01:01-10:00'),
        ('2023-08-02 12:01:01 MDT', '2023-08-02 12:01:01', '2023-08-02 12:01:01-06:00'),
        ('2023-08-02 12:01:01 MST', '2023-08-02 12:01:01', '2023-08-02 12:01:01-07:00'),
        ('2023-08-02 12:01:01 PDT', '2023-08-02 12:01:01', '2023-08-02 12:01:01-07:00'),
        ('2023-08-02 12:01:01 PM', '2023-08-02 12:01:01', '2023-08-02 12:01:01'),
        ('2023-08-02 12:01:01 PM GMT', '2023-08-02 12:01:01', '2023-08-02 12:01:01+00:00'),
        ('2023-08-02 12:01:01 PST', '2023-08-02 12:01:01', '2023-08-02 12:01:01-08:00'),
        ('2023-08-02 12:01:01 UTC', '2023-08-02 12:01:01', '2023-08-02 12:01:01+00:00'),
        ('2023-08-02 12:01:01 UTC+3:12', '2023-08-02 12:01:01', '2023-08-02 12:01:01-03:12'),
        ('2023-08-02 12:01:01 UTC-0312', '2023-08-02 12:01:01', '2023-08-02 12:01:01+03:12'),
        ('2023-08-02 12:01:01+01:01', '2023-08-02 12:01:01', '2023-08-02 12:01:01+01:01'),
        ('2023-08-02 12:01:01+01:01 AM', '2023-08-02 00:01:01', '2023-08-02 00:01:01+01:01'),
        ('2023-08-02 12:01:01+01:01 PM', '2023-08-02 12:01:01', '2023-08-02 12:01:01+01:01'),
        ('2023-08-02 12:01:01,123', '2023-08-02 12:01:01.123000', '2023-08-02 12:01:01.123000'),
        ('2023-08-02 12:01:01,123456', '2023-08-02 12:01:01.123456', '2023-08-02 12:01:01.123456'),
        ('2023-08-02 12:01:01,123456789', '2023-08-02 12:01:01.123456', '2023-08-02 12:01:01.123456'),
        ('2023-08-02 12:01:01,123456789+01:01', '2023-08-02 12:01:01.123456', '2023-08-02 12:01:01.123456+01:01'),
        ('2023-08-02 12:01:01,123456789+05:30', '2023-08-02 12:01:01.123456', '2023-08-02 12:01:01.123456+05:30'),
        ('2023-08-02 12:01:01,123456789-01:01', '2023-08-02 12:01:01.123456', '2023-08-02 12:01:01.123456-01:01'),
        ('2023-08-02 12:01:01,123456789-05:30', '2023-08-02 12:01:01.123456', '2023-08-02 12:01:01.123456-05:30'),
        ('2023-08-02 12:01:01,123456789Z', '2023-08-02 12:01:01.123456', '2023-08-02 12:01:01.123456+00:00'),
        ('2023-08-02 12:01:01-01:01', '2023-08-02 12:01:01', '2023-08-02 12:01:01-01:01'),
        ('2023-08-02 12:01:01-01:01 AM', '2023-08-02 00:01:01', '2023-08-02 00:01:01-01:01'),
        ('2023-08-02 12:01:01-01:01 PM', '2023-08-02 12:01:01', '2023-08-02 12:01:01-01:01'),
        ('2023-08-02 12:01:01.001001', '2023-08-02 12:01:01.001001', '2023-08-02 12:01:01.001001'),
        ('2023-08-02 12:01:01.001001+01:01', '2023-08-02 12:01:01.001001', '2023-08-02 12:01:01.001001+01:01'),
        ('2023-08-02 12:01:01.001001-01:01', '2023-08-02 12:01:01.001001', '2023-08-02 12:01:01.001001-01:01'),
        ('2023-08-02 12:01:01.001001-12:01', '2023-08-02 12:01:01.001001', '2023-08-02 12:01:01.001001-12:01'),
        ('2023-08-02 12:01:01.001001000', '2023-08-02 12:01:01.001001', '2023-08-02 12:01:01.001001'),
        ('2023-08-02 12:01:01.001001000+01:01', '2023-08-02 12:01:01.001001', '2023-08-02 12:01:01.001001+01:01'),
        ('2023-08-02 12:01:01.001001000+0530', '2023-08-02 12:01:01.001001', '2023-08-02 12:01:01.001001+05:30'),
        ('2023-08-02 12:01:01.001001000+05:30', '2023-08-02 12:01:01.001001', '2023-08-02 12:01:01.001001+05:30'),
        ('2023-08-02 12:01:01.001001000-01:01', '2023-08-02 12:01:01.001001', '2023-08-02 12:01:01.001001-01:01'),
        ('2023-08-02 12:01:01.001001000-0530', '2023-08-02 12:01:01.001001', '2023-08-02 12:01:01.001001-05:30'),
        ('2023-08-02 12:01:01.001001000-05:30', '2023-08-02 12:01:01.001001', '2023-08-02 12:01:01.001001-05:30'),
        ('2023-08-02 12:01:01.001001000000', '2023-08-02 12:01:01.001001', '2023-08-02 12:01:01.001001'),
        ('2023-08-02 12:01:01.001001000000+01:01', '2023-08-02 12:01:01.001001', '2023-08-02 12:01:01.001001+01:01'),
        ('2023-08-02 12:01:01.001001000000+0530', '2023-08-02 12:01:01.001001', '2023-08-02 12:01:01.001001+05:30'),
        ('2023-08-02 12:01:01.001001000000+05:30', '2023-08-02 12:01:01.001001', '2023-08-02 12:01:01.001001+05:30'),
        ('2023-08-02 12:01:01.001001000000-01:01', '2023-08-02 12:01:01.001001', '2023-08-02 12:01:01.001001-01:01'),
        ('2023-08-02 12:01:01.001001000000-0530', '2023-08-02 12:01:01.001001', '2023-08-02 12:01:01.001001-05:30'),
        ('2023-08-02 12:01:01.001001000000-05:30', '2023-08-02 12:01:01.001001', '2023-08-02 12:01:01.001001-05:30'),
        ('2023-08-02 12:01:01.001001000000Z', '2023-08-02 12:01:01.001001', '2023-08-02 12:01:01.001001+00:00'),
        ('2023-08-02 12:01:01.001001000Z', '2023-08-02 12:01:01.001001', '2023-08-02 12:01:01.001001+00:00'),
        ('2023-08-02 12:01:01.001001Z', '2023-08-02 12:01:01.001001', '2023-08-02 12:01:01.001001+00:00'),
        ('2023-08-02 12:01:01.001Z', '2023-08-02 12:01:01.001000', '2023-08-02 12:01:01.001000+00:00'),
        ('2023-08-02 12:01:01.001Z AM', '2023-08-02 00:01:01.001000', '2023-08-02 00:01:01.001000+00:00'),
        ('2023-08-02 12:01:01.001Z PM', '2023-08-02 12:01:01.001000', '2023-08-02 12:01:01.001000+00:00'),
        ('2023-08-02 12:01:01.123,456,789', '2023-08-02 12:01:01.123000', '2023-08-02 12:01:01.123000'),
        ('2023-08-02 12:01:01.123456', '2023-08-02 12:01:01.123456', '2023-08-02 12:01:01.123456'),
        ('2023-08-02 12:01:01.123456+01:01', '2023-08-02 12:01:01.123456', '2023-08-02 12:01:01.123456+01:01'),
        ('2023-08-02 12:01:01.123456+05:30', '2023-08-02 12:01:01.123456', '2023-08-02 12:01:01.123456+05:30'),
        ('2023-08-02 12:01:01.123456-01:01', '2023-08-02 12:01:01.123456', '2023-08-02 12:01:01.123456-01:01'),
        ('2023-08-02 12:01:01.123456-05:30', '2023-08-02 12:01:01.123456', '2023-08-02 12:01:01.123456-05:30'),
        ('2023-08-02 12:01:01.123456789', '2023-08-02 12:01:01.123456', '2023-08-02 12:01:01.123456'),
        ('2023-08-02 12:01:01.123456789+01:01', '2023-08-02 12:01:01.123456', '2023-08-02 12:01:01.123456+01:01'),
        ('2023-08-02 12:01:01.123456789+05:30', '2023-08-02 12:01:01.123456', '2023-08-02 12:01:01.123456+05:30'),
        ('2023-08-02 12:01:01.123456789-01:01', '2023-08-02 12:01:01.123456', '2023-08-02 12:01:01.123456-01:01'),
        ('2023-08-02 12:01:01.123456789-05:30', '2023-08-02 12:01:01.123456', '2023-08-02 12:01:01.123456-05:30'),
        ('2023-08-02 12:01:01.123456789123', '2023-08-02 12:01:01.123456', '2023-08-02 12:01:01.123456'),
        ('2023-08-02 12:01:01.123456789123+05:30', '2023-08-02 12:01:01.123456', '2023-08-02 12:01:01.123456+05:30'),
        ('2023-08-02 12:01:01.123456789123456', '2023-08-02 12:01:01.123456', '2023-08-02 12:01:01.123456'),
        ('2023-08-02 12:01:01.123456789123456+01:01', '2023-08-02 12:01:01.123456', '2023-08-02 12:01:01.123456+01:01'),
        ('2023-08-02 12:01:01.123456789123456+0530', '2023-08-02 12:01:01.123456', '2023-08-02 12:01:01.123456+05:30'),
        ('2023-08-02 12:01:01.123456789123456+05:30', '2023-08-02 12:01:01.123456', '2023-08-02 12:01:01.123456+05:30'),
        ('2023-08-02 12:01:01.123456789123456-01:01', '2023-08-02 12:01:01.123456', '2023-08-02 12:01:01.123456-01:01'),
        ('2023-08-02 12:01:01.123456789123456-0530', '2023-08-02 12:01:01.123456', '2023-08-02 12:01:01.123456-05:30'),
        ('2023-08-02 12:01:01.123456789123456-05:30', '2023-08-02 12:01:01.123456', '2023-08-02 12:01:01.123456-05:30'),
        ('2023-08-02 12:01:01.123456789123456Z', '2023-08-02 12:01:01.123456', '2023-08-02 12:01:01.123456+00:00'),
        ('2023-08-02 12:01:01.123456789Z', '2023-08-02 12:01:01.123456', '2023-08-02 12:01:01.123456+00:00'),
        ('2023-08-02 12:01:01.123456Z', '2023-08-02 12:01:01.123456', '2023-08-02 12:01:01.123456+00:00'),
        ('2023-08-02 12Z', '2023-08-02 12:00:00', '2023-08-02 12:00:00+00:00'),
        ('2023-08-02 12a.m.', '2023-08-02 00:00:00', '2023-08-02 00:00:00'),
        ('2023-08-02 12h', '2023-08-02 12:00:00', '2023-08-02 12:00:00'),
        ('2023-08-02 12h01m', '2023-08-02 12:01:00', '2023-08-02 12:01:00'),
        ('2023-08-02 12h01m01s', '2023-08-02 12:01:01', '2023-08-02 12:01:01'),
        ('2023-08-02 12p.m.', '2023-08-02 12:00:00', '2023-08-02 12:00:00'),
        ('2023-08-02 at 01:01', '2023-08-02 01:01:00', '2023-08-02 01:01:00'),
        ('2023-08-02 at 12 AM', '2023-08-02 00:00:00', '2023-08-02 00:00:00'),
        ('2023-08-02 at 12 PM', '2023-08-02 12:00:00', '2023-08-02 12:00:00'),
        ('2023-08-02 at 12:01', '2023-08-02 12:01:00', '2023-08-02 12:01:00'),
        ('2023-08-02 sun.', '2023-08-06 00:00:00', '2023-08-06 00:00:00'),
        ('2023-08-02 sat.', '2023-08-05 00:00:00', '2023-08-05 00:00:00'),
        ('2023-08-02T01:01 AM', '2023-08-02 01:01:00', '2023-08-02 01:01:00'),
        ('2023-08-02T01:01 PM', '2023-08-02 13:01:00', '2023-08-02 13:01:00'),
        ('2023-08-02T01:01:01', '2023-08-02 01:01:01', '2023-08-02 01:01:01'),
        ('2023-08-02T01:01:01 AM', '2023-08-02 01:01:01', '2023-08-02 01:01:01'),
        ('2023-08-02T01:01:01 PM', '2023-08-02 13:01:01', '2023-08-02 13:01:01'),
        ('2023-08-02T01:01:01+01:01', '2023-08-02 01:01:01', '2023-08-02 01:01:01+01:01'),
        ('2023-08-02T01:01:01-01:01', '2023-08-02 01:01:01', '2023-08-02 01:01:01-01:01'),
        ('2023-08-02T01:01:01.001001', '2023-08-02 01:01:01.001001', '2023-08-02 01:01:01.001001'),
        ('2023-08-02T01:01:01.001001+01:01', '2023-08-02 01:01:01.001001', '2023-08-02 01:01:01.001001+01:01'),
        ('2023-08-02T01:01:01.001001-01:01', '2023-08-02 01:01:01.001001', '2023-08-02 01:01:01.001001-01:01'),
        ('2023-08-02T01:01:01.001001Z', '2023-08-02 01:01:01.001001', '2023-08-02 01:01:01.001001+00:00'),
        ('2023-08-02T01:01:01.001Z', '2023-08-02 01:01:01.001000', '2023-08-02 01:01:01.001000+00:00'),
        ('2023-08-02T12', '2023-08-02 12:00:00', '2023-08-02 12:00:00'),
        ('2023-08-02T12+01:01', '2023-08-02 12:00:00', '2023-08-02 12:00:00+01:01'),
        ('2023-08-02T12+05:30', '2023-08-02 12:00:00', '2023-08-02 12:00:00+05:30'),
        ('2023-08-02T12-01:01', '2023-08-02 12:00:00', '2023-08-02 12:00:00-01:01'),
        ('2023-08-02T12-05:30', '2023-08-02 12:00:00', '2023-08-02 12:00:00-05:30'),
        ('2023-08-02T1201+01:01', '2023-08-02 12:01:00', '2023-08-02 12:01:00+01:01'),
        ('2023-08-02T1201+05:30', '2023-08-02 12:01:00', '2023-08-02 12:01:00+05:30'),
        ('2023-08-02T1201-01:01', '2023-08-02 12:01:00', '2023-08-02 12:01:00-01:01'),
        ('2023-08-02T1201-05:30', '2023-08-02 12:01:00', '2023-08-02 12:01:00-05:30'),
        ('2023-08-02T120101+01:01', '2023-08-02 12:01:01', '2023-08-02 12:01:01+01:01'),
        ('2023-08-02T120101+05:30', '2023-08-02 12:01:01', '2023-08-02 12:01:01+05:30'),
        ('2023-08-02T120101-01:01', '2023-08-02 12:01:01', '2023-08-02 12:01:01-01:01'),
        ('2023-08-02T120101-05:30', '2023-08-02 12:01:01', '2023-08-02 12:01:01-05:30'),
        ('2023-08-02T120101Z', '2023-08-02 12:01:01', '2023-08-02 12:01:01+00:00'),
        ('2023-08-02T1201Z', '2023-08-02 12:01:00', '2023-08-02 12:01:00+00:00'),
        ('2023-08-02T12:01', '2023-08-02 12:01:00', '2023-08-02 12:01:00'),
        ('2023-08-02T12:01 AM', '2023-08-02 00:01:00', '2023-08-02 00:01:00'),
        ('2023-08-02T12:01 PM', '2023-08-02 12:01:00', '2023-08-02 12:01:00'),
        ('2023-08-02T12:01:00Z', '2023-08-02 12:01:00', '2023-08-02 12:01:00+00:00'),
        ('2023-08-02T12:01:01', '2023-08-02 12:01:01', '2023-08-02 12:01:01'),
        ('2023-08-02T12:01:01 AM', '2023-08-02 00:01:01', '2023-08-02 00:01:01'),
        ('2023-08-02T12:01:01 PM', '2023-08-02 12:01:01', '2023-08-02 12:01:01'),
        ('2023-08-02T12:01:01+0000', '2023-08-02 12:01:01', '2023-08-02 12:01:01+00:00'),
        ('2023-08-02T12:01:01+01:01', '2023-08-02 12:01:01', '2023-08-02 12:01:01+01:01'),
        ('2023-08-02T12:01:01+0530', '2023-08-02 12:01:01', '2023-08-02 12:01:01+05:30'),
        ('2023-08-02T12:01:01+05:30', '2023-08-02 12:01:01', '2023-08-02 12:01:01+05:30'),
        ('2023-08-02T12:01:01,123456789Z', '2023-08-02 12:01:01.123456', '2023-08-02 12:01:01.123456+00:00'),
        ('2023-08-02T12:01:01-01:01', '2023-08-02 12:01:01', '2023-08-02 12:01:01-01:01'),
        ('2023-08-02T12:01:01-0530', '2023-08-02 12:01:01', '2023-08-02 12:01:01-05:30'),
        ('2023-08-02T12:01:01-05:30', '2023-08-02 12:01:01', '2023-08-02 12:01:01-05:30'),
        ('2023-08-02T12:01:01.001+0530', '2023-08-02 12:01:01.001000', '2023-08-02 12:01:01.001000+05:30'),
        ('2023-08-02T12:01:01.001+05:30', '2023-08-02 12:01:01.001000', '2023-08-02 12:01:01.001000+05:30'),
        ('2023-08-02T12:01:01.001-0530', '2023-08-02 12:01:01.001000', '2023-08-02 12:01:01.001000-05:30'),
        ('2023-08-02T12:01:01.001-05:30', '2023-08-02 12:01:01.001000', '2023-08-02 12:01:01.001000-05:30'),
        ('2023-08-02T12:01:01.001001', '2023-08-02 12:01:01.001001', '2023-08-02 12:01:01.001001'),
        ('2023-08-02T12:01:01.001001+01:01', '2023-08-02 12:01:01.001001', '2023-08-02 12:01:01.001001+01:01'),
        ('2023-08-02T12:01:01.001001+05:30', '2023-08-02 12:01:01.001001', '2023-08-02 12:01:01.001001+05:30'),
        ('2023-08-02T12:01:01.001001-01:01', '2023-08-02 12:01:01.001001', '2023-08-02 12:01:01.001001-01:01'),
        ('2023-08-02T12:01:01.001001-05:30', '2023-08-02 12:01:01.001001', '2023-08-02 12:01:01.001001-05:30'),
        ('2023-08-02T12:01:01.001001Z', '2023-08-02 12:01:01.001001', '2023-08-02 12:01:01.001001+00:00'),
        ('2023-08-02T12:01:01.001Z', '2023-08-02 12:01:01.001000', '2023-08-02 12:01:01.001000+00:00'),
        ('2023-08-02T12:01:01.123456+01:01', '2023-08-02 12:01:01.123456', '2023-08-02 12:01:01.123456+01:01'),
        ('2023-08-02T12:01:01.123456+05:30', '2023-08-02 12:01:01.123456', '2023-08-02 12:01:01.123456+05:30'),
        ('2023-08-02T12:01:01.123456-01:01', '2023-08-02 12:01:01.123456', '2023-08-02 12:01:01.123456-01:01'),
        ('2023-08-02T12:01:01.123456-05:30', '2023-08-02 12:01:01.123456', '2023-08-02 12:01:01.123456-05:30'),
        ('2023-08-02T12:01:01.123456789+01:01', '2023-08-02 12:01:01.123456', '2023-08-02 12:01:01.123456+01:01'),
        ('2023-08-02T12:01:01.123456789+05:30', '2023-08-02 12:01:01.123456', '2023-08-02 12:01:01.123456+05:30'),
        ('2023-08-02T12:01:01.123456789-01:01', '2023-08-02 12:01:01.123456', '2023-08-02 12:01:01.123456-01:01'),
        ('2023-08-02T12:01:01.123456789-05:30', '2023-08-02 12:01:01.123456', '2023-08-02 12:01:01.123456-05:30'),
        ('2023-08-02T12:01:01.123456789Z', '2023-08-02 12:01:01.123456', '2023-08-02 12:01:01.123456+00:00'),
        ('2023-08-02T12:01:01.123456Z', '2023-08-02 12:01:01.123456', '2023-08-02 12:01:01.123456+00:00'),
        ('2023-08-02T12:01Z', '2023-08-02 12:01:00', '2023-08-02 12:01:00+00:00'),
        ('2023-08-02T12Z', '2023-08-02 12:00:00', '2023-08-02 12:00:00+00:00'),
        ('2023-12-31 11:59 AM', '2023-12-31 11:59:00', '2023-12-31 11:59:00'),
        ('2023-12-31 11:59 PM', '2023-12-31 23:59:00', '2023-12-31 23:59:00'),
        ('2023-12-31 11:59 am', '2023-12-31 11:59:00', '2023-12-31 11:59:00'),
        ('2023-12-31 11:59 pm', '2023-12-31 23:59:00', '2023-12-31 23:59:00'),
        ('2023-12-31 23:59', '2023-12-31 23:59:00', '2023-12-31 23:59:00'),
        ('2023-214', '2023-08-02 00:00:00', '2023-08-02 00:00:00'),
        ('2023-214 12:01:01.001', '2023-08-02 12:01:01.001000', '2023-08-02 12:01:01.001000'),
        ('2023-Aug 02', '2023-08-02 00:00:00', '2023-08-02 00:00:00'),
        ('2023-Aug-02', '2023-08-02 00:00:00', '2023-08-02 00:00:00'),
        ('2023-Aug-02 12:01', '2023-08-02 12:01:00', '2023-08-02 12:01:00'),
        ('2023-Aug-02 12:01:01', '2023-08-02 12:01:01', '2023-08-02 12:01:01'),
        ('2023-Aug-2', '2023-08-02 00:00:00', '2023-08-02 00:00:00'),
        ('2023-Aug-2 12:01', '2023-08-02 12:01:00', '2023-08-02 12:01:00'),
        ('2023-Aug-2 12:01:01', '2023-08-02 12:01:01', '2023-08-02 12:01:01'),
        ('2023-August-02', '2023-08-02 00:00:00', '2023-08-02 00:00:00'),
        ('2023-August-02 12:01', '2023-08-02 12:01:00', '2023-08-02 12:01:00'),
        ('2023-August-02 12:01:01', '2023-08-02 12:01:01', '2023-08-02 12:01:01'),
        ('2023-August-2', '2023-08-02 00:00:00', '2023-08-02 00:00:00'),
        ('2023-August-2 12:01', '2023-08-02 12:01:00', '2023-08-02 12:01:00'),
        ('2023-August-2 12:01:01', '2023-08-02 12:01:01', '2023-08-02 12:01:01'),
        ('2023-W31', '2023-07-31 00:00:00', '2023-07-31 00:00:00'),
        ('2023-W31T12:01:01.001', '2023-07-31 12:01:01.001000', '2023-07-31 12:01:01.001000'),
        ('2023-W31-3', '2023-08-02 00:00:00', '2023-08-02 00:00:00'),
        ('2023-W31-3T12:01:01.001', '2023-08-02 12:01:01.001000', '2023-08-02 12:01:01.001000'),
        ('2023.02.08 22:01 PM', '2023-02-08 22:01:00', '2023-02-08 22:01:00'),
        ('2023.08.02', '2023-08-02 00:00:00', '2023-08-02 00:00:00'),
        ('2023.08.02 12', '2023-08-02 12:00:00', '2023-08-02 12:00:00'),
        ('2023.08.02 1201', '2023-08-02 12:01:00', '2023-08-02 12:01:00'),
        ('2023.08.02 120101', '2023-08-02 12:01:01', '2023-08-02 12:01:01'),
        ('2023.08.02 12:01', '2023-08-02 12:01:00', '2023-08-02 12:01:00'),
        ('2023.08.02 12:01 AM', '2023-08-02 00:01:00', '2023-08-02 00:01:00'),
        ('2023.08.02 12:01 PM', '2023-08-02 12:01:00', '2023-08-02 12:01:00'),
        ('2023.08.02 12:01:01', '2023-08-02 12:01:01', '2023-08-02 12:01:01'),
        ('2023.08.02.12', '2023-08-02 12:00:00', '2023-08-02 12:00:00'),
        ('2023.08.02.1201', '2023-08-02 12:01:00', '2023-08-02 12:01:00'),
        ('2023.08.02.120101', '2023-08-02 12:01:01', '2023-08-02 12:01:01'),
        ('2023/08/02', '2023-08-02 00:00:00', '2023-08-02 00:00:00'),
        ('2023/08/02 01:01 AM', '2023-08-02 01:01:00', '2023-08-02 01:01:00'),
        ('2023/08/02 01:01 PM', '2023-08-02 13:01:00', '2023-08-02 13:01:00'),
        ('2023/08/02 01:01:01 AM', '2023-08-02 01:01:01', '2023-08-02 01:01:01'),
        ('2023/08/02 01:01:01 PM', '2023-08-02 13:01:01', '2023-08-02 13:01:01'),
        ('2023/08/02 12:01', '2023-08-02 12:01:00', '2023-08-02 12:01:00'),
        ('2023/08/02 12:01 AM', '2023-08-02 00:01:00', '2023-08-02 00:01:00'),
        ('2023/08/02 12:01 PM', '2023-08-02 12:01:00', '2023-08-02 12:01:00'),
        ('2023/08/02 12:01:01', '2023-08-02 12:01:01', '2023-08-02 12:01:01'),
        ('2023/08/02 12:01:01 AM', '2023-08-02 00:01:01', '2023-08-02 00:01:01'),
        ('2023/08/02 12:01:01 PM', '2023-08-02 12:01:01', '2023-08-02 12:01:01'),
        ('2023/08/02 12:01:01,123456789', '2023-08-02 12:01:01.123456', '2023-08-02 12:01:01.123456'),
        ('2023/08/02 12:01:01,123456789+01:01', '2023-08-02 12:01:01.123456', '2023-08-02 12:01:01.123456+01:01'),
        ('2023/08/02 12:01:01,123456789Z', '2023-08-02 12:01:01.123456', '2023-08-02 12:01:01.123456+00:00'),
        ('2023/08/02 at 12:01 AM', '2023-08-02 00:01:00', '2023-08-02 00:01:00'),
        ('2023/08/02 at 12:01 PM', '2023-08-02 12:01:00', '2023-08-02 12:01:00'),
        ('20230802', '2023-08-02 00:00:00', '2023-08-02 00:00:00'),
        ('20230802 12', '2023-08-02 12:00:00', '2023-08-02 12:00:00'),
        ('20230802 1201', '2023-08-02 12:01:00', '2023-08-02 12:01:00'),
        ('20230802 120101', '2023-08-02 12:01:01', '2023-08-02 12:01:01'),
        ('2023080212', '2023-08-02 12:00:00', '2023-08-02 12:00:00'),
        ('202308021201', '2023-08-02 12:01:00', '2023-08-02 12:01:00'),
        ('20230802120101', '2023-08-02 12:01:01', '2023-08-02 12:01:01'),
        ('20230802120101+0000', '2023-08-02 12:01:01', '2023-08-02 12:01:01+00:00'),
        ('20230802120101Z', '2023-08-02 12:01:01', '2023-08-02 12:01:01+00:00'),
        ('20230802T12', '2023-08-02 12:00:00', '2023-08-02 12:00:00'),
        ('20230802T1201', '2023-08-02 12:01:00', '2023-08-02 12:01:00'),
        ('20230802T120101', '2023-08-02 12:01:01', '2023-08-02 12:01:01'),
        ('20230802T120101+0000', '2023-08-02 12:01:01', '2023-08-02 12:01:01+00:00'),
        ('20230802T120101.001', '2023-08-02 12:01:01.001000', '2023-08-02 12:01:01.001000'),
        ('20230802T120101.001001', '2023-08-02 12:01:01.001001', '2023-08-02 12:01:01.001001'),
        ('20230802T120101.001001000', '2023-08-02 12:01:01.001001', '2023-08-02 12:01:01.001001'),
        ('20230802T120101.001001000+01:01', '2023-08-02 12:01:01.001001', '2023-08-02 12:01:01.001001+01:01'),
        ('20230802T120101.001001000+05:30', '2023-08-02 12:01:01.001001', '2023-08-02 12:01:01.001001+05:30'),
        ('20230802T120101.001001000-01:01', '2023-08-02 12:01:01.001001', '2023-08-02 12:01:01.001001-01:01'),
        ('20230802T120101.001001000-05:30', '2023-08-02 12:01:01.001001', '2023-08-02 12:01:01.001001-05:30'),
        ('20230802T120101.001001000Z', '2023-08-02 12:01:01.001001', '2023-08-02 12:01:01.001001+00:00'),
        ('20230802T120101Z', '2023-08-02 12:01:01', '2023-08-02 12:01:01+00:00'),
        ('2023年08月02', '2023-08-02 00:00:00', '2023-08-02 00:00:00'),
        ('2023年08月02日', '2023-08-02 00:00:00', '2023-08-02 00:00:00'),
        ('2023年08月02日 12时 上午', '2023-08-02 00:00:00', '2023-08-02 00:00:00'),
        ('2023年08月02日 12时 下午', '2023-08-02 12:00:00', '2023-08-02 12:00:00'),
        ('2023年08月02日 12时01分01秒', '2023-08-02 12:01:01', '2023-08-02 12:01:01'),
        ('2023年08月02日12时01分01秒', '2023-08-02 12:01:01', '2023-08-02 12:01:01'),
        ('2023年8月2日', '2023-08-02 00:00:00', '2023-08-02 00:00:00'),
        ('2023年8月2日 12时01分01秒', '2023-08-02 12:01:01', '2023-08-02 12:01:01'),
        ('2023年8月2日 12点 上午', '2023-08-02 00:00:00', '2023-08-02 00:00:00'),
        ('2023年8月2日 12点 下午', '2023-08-02 12:00:00', '2023-08-02 12:00:00'),
        ('2023年8月2日12时', '2023-08-02 12:00:00', '2023-08-02 12:00:00'),
        ('2023年8月2日12时01分01秒', '2023-08-02 12:01:01', '2023-08-02 12:01:01'),
        ('2023年8月2日12时01分01秒 GMT', '2023-08-02 12:01:01', '2023-08-02 12:01:01+00:00'),
        ('2024-02-29 12:01:01', '2024-02-29 12:01:01', '2024-02-29 12:01:01'),
        ('23-08-02', '2002-08-23 00:00:00', '2002-08-23 00:00:00'),
        ('23/08/02', '2002-08-23 00:00:00', '2002-08-23 00:00:00'),
        ('23:59 on 31 Dec 2023', '2023-12-31 23:59:00', '2023-12-31 23:59:00'),
        ('25 03 Sep', '2025-09-03 00:00:00', '2025-09-03 00:00:00'),
        ('25 09 03', '2003-09-25 00:00:00', '2003-09-25 00:00:00'),
        ('25 09 2003', '2003-09-25 00:00:00', '2003-09-25 00:00:00'),
        ('25 Sep 2003', '2003-09-25 00:00:00', '2003-09-25 00:00:00'),
        ('25-09-2003', '2003-09-25 00:00:00', '2003-09-25 00:00:00'),
        ('25-Sep-2003', '2003-09-25 00:00:00', '2003-09-25 00:00:00'),
        ('25.09.2003', '2003-09-25 00:00:00', '2003-09-25 00:00:00'),
        ('25.Sep.2003', '2003-09-25 00:00:00', '2003-09-25 00:00:00'),
        ('25/09/2003', '2003-09-25 00:00:00', '2003-09-25 00:00:00'),
        ('25/Sep/2003', '2003-09-25 00:00:00', '2003-09-25 00:00:00'),
        ('2er août 2023 à midi', '2023-08-02 00:00:00', '2023-08-02 00:00:00'),
        ('2st August', '0001-08-02 00:00:00', '0001-08-02 00:00:00'),
        ('2st August 2023 12:01 PM', '2023-08-02 12:01:00', '2023-08-02 12:01:00'),
        ('2st August 2023 12:01:01 PM', '2023-08-02 12:01:01', '2023-08-02 12:01:01'),
        ('2st August 2023 at 12 AM', '2023-08-02 00:00:00', '2023-08-02 00:00:00'),
        ('2st August 2023 at 12 PM', '2023-08-02 12:00:00', '2023-08-02 12:00:00'),
        ('2st day of August, 2023 at 12:01 PM', '2023-08-02 12:01:00', '2023-08-02 12:01:00'),
        ('2st of August 2023 at Midnight', '2023-08-02 00:00:00', '2023-08-02 00:00:00'),
        ('2st of August 2023 at Noon', '2023-08-02 00:00:00', '2023-08-02 00:00:00'),
        ('2st of August, 2023 at 12:01 AM', '2023-08-02 00:01:00', '2023-08-02 00:01:00'),
        ('2st of August, 2023 at 12:01 PM', '2023-08-02 12:01:00', '2023-08-02 12:01:00'),
        ('2st of May 2003', '2003-05-02 00:00:00', '2003-05-02 00:00:00'),
        ('3 AM', '0001-01-01 03:00:00', '0001-01-01 03:00:00'),
        ('3 PM', '0001-01-01 15:00:00', '0001-01-01 15:00:00'),
        ('31-12-2023 23:59:59', '2023-12-31 23:59:59', '2023-12-31 23:59:59'),
        ('31-Dec-00', '2000-12-31 00:00:00', '2000-12-31 00:00:00'),
        ('31/12/2023 23:59:59', '2023-12-31 23:59:59', '2023-12-31 23:59:59'),
        ('31st December 2023 23:59:59', '2023-12-31 23:59:59', '2023-12-31 23:59:59'),
        ('36m05', '0001-01-01 00:36:05', '0001-01-01 00:36:05'),
        ('36m05 s', '0001-01-01 00:36:05', '0001-01-01 00:36:05'),
        ('36m5', '0001-01-01 00:36:05', '0001-01-01 00:36:05'),
        ('36m5s', '0001-01-01 00:36:05', '0001-01-01 00:36:05'),
        ('3am', '0001-01-01 03:00:00', '0001-01-01 03:00:00'),
        ('3pm', '0001-01-01 15:00:00', '0001-01-01 15:00:00'),
        ('3rd of May 2001', '2001-05-03 00:00:00', '2001-05-03 00:00:00'),
        ('4 Jul 1976', '1976-07-04 00:00:00', '1976-07-04 00:00:00'),
        ('4 jul 1976', '1976-07-04 00:00:00', '1976-07-04 00:00:00'),
        ('53.123123s', '0001-01-01 00:00:53.123123', '0001-01-01 00:00:53.123123'),
        ('5:50 A.M. on June 13, 1990', '1990-06-13 05:50:00', '1990-06-13 05:50:00'),
        ('5:50 P.M. on June 13, 1990', '1990-06-13 17:50:00', '1990-06-13 17:50:00'),
        ('5th of March 2001', '2001-03-05 00:00:00', '2001-03-05 00:00:00'),
        ('7 4 1976', '1976-07-04 00:00:00', '1976-07-04 00:00:00'),
        ('7-4-76', '1976-07-04 00:00:00', '1976-07-04 00:00:00'),
        ('8 02 2023', '2023-08-02 00:00:00', '2023-08-02 00:00:00'),
        ('8 02 2023 12:01', '2023-08-02 12:01:00', '2023-08-02 12:01:00'),
        ('8 02 2023 12:01:01', '2023-08-02 12:01:01', '2023-08-02 12:01:01'),
        ('8 2 2023', '2023-08-02 00:00:00', '2023-08-02 00:00:00'),
        ('8 2 2023 12:01', '2023-08-02 12:01:00', '2023-08-02 12:01:00'),
        ('8 2 2023 12:01:01', '2023-08-02 12:01:01', '2023-08-02 12:01:01'),
        ('8/2/2023 12:01', '2023-08-02 12:01:00', '2023-08-02 12:01:00'),
        ('950404 122212', '1995-04-04 12:22:12', '1995-04-04 12:22:12'),
        ('April 2009', '2009-04-01 00:00:00', '2009-04-01 00:00:00'),
        ('Aug 2, 2023', '2023-08-02 00:00:00', '2023-08-02 00:00:00'),
        ('Aug 2, 2023 01:01:01', '2023-08-02 01:01:01', '2023-08-02 01:01:01'),
        ('Aug 2, 2023 12:01 AM', '2023-08-02 00:01:00', '2023-08-02 00:01:00'),
        ('Aug 2, 2023 12:01 PM', '2023-08-02 12:01:00', '2023-08-02 12:01:00'),
        ('Aug 2, 2023 12:01:01', '2023-08-02 12:01:01', '2023-08-02 12:01:01'),
        ('Aug 2st, 2023', '2023-08-02 00:00:00', '2023-08-02 00:00:00'),
        ('Aug-02-2023 12:01 AM', '2023-08-02 00:01:00', '2023-08-02 00:01:00'),
        ('Aug-02-2023 12:01 PM', '2023-08-02 12:01:00', '2023-08-02 12:01:00'),
        ('Aug-2-2023 12:01 AM', '2023-08-02 00:01:00', '2023-08-02 00:01:00'),
        ('Aug-2-2023 12:01 PM', '2023-08-02 12:01:00', '2023-08-02 12:01:00'),
        ('August 2 2023 12:01 AM', '2023-08-02 00:01:00', '2023-08-02 00:01:00'),
        ('August 2 2023 12:01 PM', '2023-08-02 12:01:00', '2023-08-02 12:01:00'),
        ("August 2, '23'", '2023-08-02 00:00:00', '2023-08-02 00:00:00'),
        ('August 2, 2023', '2023-08-02 00:00:00', '2023-08-02 00:00:00'),
        ('August 2, 2023 01:01:01', '2023-08-02 01:01:01', '2023-08-02 01:01:01'),
        ('August 2, 2023 12:01 AM', '2023-08-02 00:01:00', '2023-08-02 00:01:00'),
        ('August 2, 2023 12:01 PM', '2023-08-02 12:01:00', '2023-08-02 12:01:00'),
        ('August 2, 2023 12:01:01', '2023-08-02 12:01:01', '2023-08-02 12:01:01'),
        ('August 2, 2023 at 01:01', '2023-08-02 01:01:00', '2023-08-02 01:01:00'),
        ('August 2, 2023 at 12:01', '2023-08-02 12:01:00', '2023-08-02 12:01:00'),
        ('August 2, 2023 at 12:01 AM', '2023-08-02 00:01:00', '2023-08-02 00:01:00'),
        ('August 2, 2023 at 12:01 PM', '2023-08-02 12:01:00', '2023-08-02 12:01:00'),
        ('August 2, 2023 at 12:01 PM AKDT', '2023-08-02 12:01:00', '2023-08-02 12:01:00-08:00'),
        ('August 2, 2023 at 12:01 PM AKST', '2023-08-02 12:01:00', '2023-08-02 12:01:00-09:00'),
        ('August 2, 2023 at 12:01 PM CDT', '2023-08-02 12:01:00', '2023-08-02 12:01:00-05:00'),
        ('August 2, 2023 at 12:01 PM EDT', '2023-08-02 12:01:00', '2023-08-02 12:01:00-04:00'),
        ('August 2, 2023 at 12:01 PM EST', '2023-08-02 12:01:00', '2023-08-02 12:01:00-05:00'),
        ('August 2, 2023 at 12:01 PM HST', '2023-08-02 12:01:00', '2023-08-02 12:01:00-10:00'),
        ('August 2, 2023 at 12:01 PM MDT', '2023-08-02 12:01:00', '2023-08-02 12:01:00-06:00'),
        ('August 2, 2023 at 12:01 PM MST', '2023-08-02 12:01:00', '2023-08-02 12:01:00-07:00'),
        ('August 2, 2023 at 12:01 PM PDT', '2023-08-02 12:01:00', '2023-08-02 12:01:00-07:00'),
        ('August 2, 2023 at 12:01 PM PST', '2023-08-02 12:01:00', '2023-08-02 12:01:00-08:00'),
        ('August 2, 2023 at 12:01 PM UTC', '2023-08-02 12:01:00', '2023-08-02 12:01:00+00:00'),
        ('August 2, 2023, at 12:01 AM', '2023-08-02 00:01:00', '2023-08-02 00:01:00'),
        ('August 2, 2023, at 12:01 PM', '2023-08-02 12:01:00', '2023-08-02 12:01:00'),
        ('August 2, 2023, twelve PM', '2023-08-02 00:00:00', '2023-08-02 00:00:00'),
        ("August 2, 2023, twelve o'clock PM", '2023-08-02 00:00:00', '2023-08-02 00:00:00'),
        ('August 2st', '0001-08-02 00:00:00', '0001-08-02 00:00:00'),
        ('August 32', '2032-08-01 00:00:00', '2032-08-01 00:00:00'),
        ('Feb 30', '2030-02-01 00:00:00', '2030-02-01 00:00:00'),
        ('Feb 28', '0001-02-28 00:00:00', '0001-02-28 00:00:00'),
        ('Feb 29', '0001-02-28 00:00:00', '0001-02-28 00:00:00'),
        ('August 2st 2023', '2023-08-02 00:00:00', '2023-08-02 00:00:00'),
        ('August 2st 2023 12:01:01 AM', '2023-08-02 00:01:01', '2023-08-02 00:01:01'),
        ('August 2st 2023 12:01:01 PM', '2023-08-02 12:01:01', '2023-08-02 12:01:01'),
        ('August 2st, 2023 01:01', '2023-08-02 01:01:00', '2023-08-02 01:01:00'),
        ('August 2st, 2023 12:01 AM', '2023-08-02 00:01:00', '2023-08-02 00:01:00'),
        ('August 2st, 2023 12:01 PM', '2023-08-02 12:01:00', '2023-08-02 12:01:00'),
        ('August 2st, 2023 12:01 PM +05:30', '2023-08-02 12:01:00', '2023-08-02 12:01:00+05:30'),
        ('August 2st, 2023 12:01 PM -05:30', '2023-08-02 12:01:00', '2023-08-02 12:01:00-05:30'),
        ('August 2st, 2023 12:01 PM AKDT', '2023-08-02 12:01:00', '2023-08-02 12:01:00-08:00'),
        ('August 2st, 2023 12:01 PM AKST', '2023-08-02 12:01:00', '2023-08-02 12:01:00-09:00'),
        ('August 2st, 2023 12:01 PM EST', '2023-08-02 12:01:00', '2023-08-02 12:01:00-05:00'),
        ('August 2st, 2023 12:01 PM GMT', '2023-08-02 12:01:00', '2023-08-02 12:01:00+00:00'),
        ('August 2st, 2023 12:01 PM HST', '2023-08-02 12:01:00', '2023-08-02 12:01:00-10:00'),
        ('August 2st, 2023 12:01 PM MST', '2023-08-02 12:01:00', '2023-08-02 12:01:00-07:00'),
        ('August 2st, 2023 12:01 PM PST', '2023-08-02 12:01:00', '2023-08-02 12:01:00-08:00'),
        ('August 2st, 2023 12:01 PM UTC', '2023-08-02 12:01:00', '2023-08-02 12:01:00+00:00'),
        ('August 2st, 2023 12h', '2023-08-02 12:00:00', '2023-08-02 12:00:00'),
        ('August 2st, 2023 12h01m', '2023-08-02 12:01:00', '2023-08-02 12:01:00'),
        ('August 2st, 2023 12h01m01s', '2023-08-02 12:01:01', '2023-08-02 12:01:01'),
        ('August 2st, 2023 at 12 AM', '2023-08-02 00:00:00', '2023-08-02 00:00:00'),
        ('August 2st, 2023 at 12 PM', '2023-08-02 12:00:00', '2023-08-02 12:00:00'),
        ('August 2st, 2023 at 12:01 AM', '2023-08-02 00:01:00', '2023-08-02 00:01:00'),
        ('August 2st, 2023 at 12:01 PM', '2023-08-02 12:01:00', '2023-08-02 12:01:00'),
        ('August 2st, 2023, at 12:01 PM +05:30', '2023-08-02 12:01:00', '2023-08-02 12:01:00+05:30'),
        ('August 2st, 2023, at 12:01 PM -05:30', '2023-08-02 12:01:00', '2023-08-02 12:01:00-05:30'),
        ('August 2st, 2023, at 12:01 PM AKDT', '2023-08-02 12:01:00', '2023-08-02 12:01:00-08:00'),
        ('August 2st, 2023, at 12:01 PM AKST', '2023-08-02 12:01:00', '2023-08-02 12:01:00-09:00'),
        ('August 2st, 2023, at 12:01 PM EST', '2023-08-02 12:01:00', '2023-08-02 12:01:00-05:00'),
        ('August 2st, 2023, at 12:01 PM GMT', '2023-08-02 12:01:00', '2023-08-02 12:01:00+00:00'),
        ('August 2st, 2023, at 12:01 PM HST', '2023-08-02 12:01:00', '2023-08-02 12:01:00-10:00'),
        ('August 2st, 2023, at 12:01 PM MST', '2023-08-02 12:01:00', '2023-08-02 12:01:00-07:00'),
        ('August 2st, 2023, at 12:01 PM PST', '2023-08-02 12:01:00', '2023-08-02 12:01:00-08:00'),
        ('August 2st, 2023, at 12:01 PM UTC', '2023-08-02 12:01:00', '2023-08-02 12:01:00+00:00'),
        ('August First, Twenty Twenty-Three', '0001-08-01 00:00:00', '0001-08-01 00:00:00'),
        ('August first', '0001-08-01 00:00:00', '0001-08-01 00:00:00'),
        ('August the 2st, 2023', '2023-08-02 00:00:00', '2023-08-02 00:00:00'),
        ('August the First, Two Thousand Twenty-Three', '0001-08-01 00:00:00', '0001-08-01 00:00:00'),
        ('August the first, year two thousand twenty-three, at twelve PM', '0001-08-01 00:00:00', '0001-08-01 00:00:00'),
        ('August-02-2023 12:01 AM', '2023-08-02 00:01:00', '2023-08-02 00:01:00'),
        ('August-02-2023 12:01 PM', '2023-08-02 12:01:00', '2023-08-02 12:01:00'),
        ('August-2-2023 12:01 AM', '2023-08-02 00:01:00', '2023-08-02 00:01:00'),
        ('August-2-2023 12:01 PM', '2023-08-02 12:01:00', '2023-08-02 12:01:00'),
        ('December.0031.30', '0031-12-30 00:00:00', '0031-12-30 00:00:00'),
        ('Feb of 99', '1999-02-01 00:00:00', '1999-02-01 00:00:00'),
        ('Feb-02', '0001-02-02 00:00:00', '0001-02-02 00:00:00'),
        ('Feb-02-99', '1999-02-02 00:00:00', '1999-02-02 00:00:00'),
        ('First August 2023', '2023-08-01 00:00:00', '2023-08-01 00:00:00'),
        ('First day of August 2023, 12:01 AM', '2023-08-01 00:01:00', '2023-08-01 00:01:00'),
        ('First day of August 2023, 12:01 PM', '2023-08-01 12:01:00', '2023-08-01 12:01:00'),
        ('First of August', '0001-08-01 00:00:00', '0001-08-01 00:00:00'),
        ('First of August 2023 at 12 AM', '2023-08-01 00:00:00', '2023-08-01 00:00:00'),
        ('First of August 2023 at 12 PM', '2023-08-01 12:00:00', '2023-08-01 12:00:00'),
        ('First of August, Twenty Twenty-Three', '0001-08-01 00:00:00', '0001-08-01 00:00:00'),
        ('First of August, Two Thousand and Twenty-Three', '0001-08-01 00:00:00', '0001-08-01 00:00:00'),
        ('I have a meeting on March 1, 1974.', '1974-03-01 00:00:00', '1974-03-01 00:00:00'),
        ('Jan 2 1999 11:23:34.578', '1999-01-02 11:23:34.578000', '1999-01-02 11:23:34.578000'),
        ('Jan 29, 1945 14:45 AM I going to see you there?', '1945-01-29 14:45:00', '1945-01-29 14:45:00'),
        ('July 4, 1976', '1976-07-04 00:00:00', '1976-07-04 00:00:00'),
        ('July 4, 1976 12:01:02 am', '1976-07-04 00:01:02', '1976-07-04 00:01:02'),
        ('Meet me at 3:01AM on December 3rd, 2003 at the AM/PM on Sunset', '2003-12-03 03:01:00', '2003-12-03 03:01:00'),
        ('Meet me at the AM/PM on Sunset at 3:01 PM on December 3rd, 2003', '2003-12-03 15:01:00', '2003-12-03 15:01:00'),
        ('Midday, August 2, 2023', '2023-08-02 00:00:00', '2023-08-02 00:00:00'),
        ('Midnight, August 2, 2023', '2023-08-02 00:00:00', '2023-08-02 00:00:00'),
        ('Mon Jan  2 04:24:27 1995', '1995-01-02 04:24:27', '1995-01-02 04:24:27'),
        ('Mon, 2 Aug 2023 12:01 PM', '2023-07-31 12:01:00', '2023-07-31 12:01:00'),
        ('Mon, Aug 2st, 2023 at 12:01 PM', '2023-07-31 12:01:00', '2023-07-31 12:01:00'),
        ('Mon, August 2, 2023 12:01 PM', '2023-07-31 12:01:00', '2023-07-31 12:01:00'),
        ('Mon, August 2, 2023 at 12:01 AM', '2023-07-31 00:01:00', '2023-07-31 00:01:00'),
        ('Monday, 2 August 2023 12:01 PM', '2023-07-31 12:01:00', '2023-07-31 12:01:00'),
        ('Monday, August 2, 2023 12:01 PM', '2023-07-31 12:01:00', '2023-07-31 12:01:00'),
        ('Monday, August 2st, 2023 at 12:01 AM', '2023-07-31 00:01:00', '2023-07-31 00:01:00'),
        ('Noon, August 2, 2023', '2023-08-02 00:00:00', '2023-08-02 00:00:00'),
        ('November 5, 1994, 8:15:30 am +23:59 (EST)', '1994-11-05 08:15:30', '1994-11-05 08:15:30+23:59'),
        ('November 5, 1994, 8:15:30 am +23:59(EST)', '1994-11-05 08:15:30', '1994-11-05 08:15:30+23:59'),
        ('November 5, 1994, 8:15:30 am EST', '1994-11-05 08:15:30', '1994-11-05 08:15:30-05:00'),
        ('November 5, 1994, 8:15:30 am EST+2', '1994-11-05 08:15:30', '1994-11-05 08:15:30-03:00'),
        ('October', '0001-10-01 00:00:00', '0001-10-01 00:00:00'),
        ('On June 8th, 2020, I am going to be the first man on Mars', '2020-06-08 00:00:00', '2020-06-08 00:00:00'),
        ('Sat 2023-08-02', '2023-08-05 00:00:00', '2023-08-05 00:00:00'),
        ('Sep', '0001-09-01 00:00:00', '0001-09-01 00:00:00'),
        ('Sep 10:36:28', '0001-09-01 10:36:28', '0001-09-01 10:36:28'),
        ('Sep 2003', '2003-09-01 00:00:00', '2003-09-01 00:00:00'),
        ('Sep 25 2003', '2003-09-25 00:00:00', '2003-09-25 00:00:00'),
        ('Sep-25-2003', '2003-09-25 00:00:00', '2003-09-25 00:00:00'),
        ('Sep.25.2003', '2003-09-25 00:00:00', '2003-09-25 00:00:00'),
        ('Sep/25/2003', '2003-09-25 00:00:00', '2003-09-25 00:00:00'),
        ("The first of August, 2023, at twelve o'clock PM", '2023-08-01 00:00:00', '2023-08-01 00:00:00'),
        ('Thu 10:36:28', '0001-01-04 10:36:28', '0001-01-04 10:36:28'),
        ('Thu Sep 10:36:28', '0001-08-30 10:36:28', '0001-08-30 10:36:28'),
        ('Thu Sep 24 10:36:28', '0001-09-27 10:36:28', '0001-09-27 10:36:28'),
        ('Thu Sep 24 10:36:28 2003', '2003-09-25 10:36:28', '2003-09-25 10:36:28'),
        ('Thu Sep 24 10:36:28 BRST 2003', '2003-09-25 10:36:28', '2003-09-25 10:36:28'),
        ('Thu Sep 24 2003', '2003-09-25 00:00:00', '2003-09-25 00:00:00'),
        ('Thu, 24 Sep 2003 10:49:41 -0300', '2003-09-25 10:49:41', '2003-09-25 10:49:41-03:00'),
        ('Today is 25 of September of 2003, exactly at 10:49:41 with timezone -03:00.', '2003-09-25 10:49:41', '2003-09-25 10:49:41-03:00'),
        ('Wed', '0001-01-03 00:00:00', '0001-01-03 00:00:00'),
        ('Wed, 03 Aug 2023 12:01:01 +0000', '2023-08-02 12:01:01', '2023-08-02 12:01:01+00:00'),
        ('Wed, 03 Aug 2023 12:01:01 EST', '2023-08-02 12:01:01', '2023-08-02 12:01:01-05:00'),
        ('Wed, 03 Aug 2023 12:01:01 GMT', '2023-08-02 12:01:01', '2023-08-02 12:01:01+00:00'),
        ('Wed, 03 Aug 2023 12:01:01 PST', '2023-08-02 12:01:01', '2023-08-02 12:01:01-08:00'),
        ('Wed, 03 Aug 2023 12:01:01 UTC', '2023-08-02 12:01:01', '2023-08-02 12:01:01+00:00'),
        ("Wed, July 11, '96'", '1996-07-10 00:00:00', '1996-07-10 00:00:00'),
        ('Wednesday', '0001-01-03 00:00:00', '0001-01-03 00:00:00'),
        ('le 2 août 2023 à 12h01', '2023-08-02 12:01:00', '2023-08-02 12:01:00'),
        # fmt: on
    ]

    def test_all(self, rounds: int) -> None:
        self.test_configs()
        self.test_timelex(rounds)
        self.test_parser(rounds, isoformat=True, ignoretz=True)
        self.test_parser(rounds, isoformat=True, ignoretz=False)
        self.test_parser(rounds, isoformat=False, ignoretz=True)
        self.test_parser(rounds, isoformat=False, ignoretz=False)
        self.test_parse_function()
        self.test_parse_obj_function()

    def test_configs(self) -> None:
        from cytimes.parser import Configs
        from dateutil.parser import parserinfo
        from cytimes import errors

        test = "Configs"
        self.log_start(test)

        # Build default configs
        cfg = Configs()

        # Clear settings
        cfg.clear_settings()
        self.assertFalse(len(cfg.jump))
        self.assertFalse(len(cfg.pertain))
        self.assertFalse(len(cfg.utc))
        self.assertFalse(len(cfg.tz))
        self.assertFalse(len(cfg.month))
        self.assertFalse(len(cfg.weekday))
        self.assertFalse(len(cfg.hms))
        self.assertFalse(len(cfg.ampm))

        # Reset to defaults
        cfg.reset_settings()
        self.assertTrue(len(cfg.jump))
        self.assertTrue(len(cfg.pertain))
        self.assertTrue(len(cfg.utc))
        self.assertFalse(len(cfg.tz))
        self.assertTrue(len(cfg.month))
        self.assertTrue(len(cfg.weekday))
        self.assertTrue(len(cfg.hms))
        self.assertTrue(len(cfg.ampm))

        # Test Jump
        org_jump = cfg.jump
        new_jump = {"and", "ad", "th"}
        cfg.replace_jump(set())  # . clear jump
        self.assertFalse(len(cfg.jump))
        self.assertFalse(cfg.is_jump("and"))
        cfg.add_jump("and")  # . add jump
        self.assertEqual(len(cfg.jump), 1)
        self.assertTrue(cfg.is_jump("and"))  # . lowercase
        self.assertTrue(cfg.is_jump("AND"))  # . uppercase
        self.assertTrue(cfg.is_jump("And"))  # . titlecase
        self.assertFalse(cfg.is_jump("aND"))  # . worng case
        self.assertTrue(cfg.remove_jump("and"))  # . remove jump
        self.assertFalse(cfg.is_jump("and"))
        self.assertFalse(cfg.is_jump("AND"))
        self.assertFalse(cfg.is_jump("And"))
        self.assertFalse(len(cfg.jump))
        self.assertFalse(cfg.remove_jump("and"))
        cfg.replace_jump(new_jump)  # . replace jump
        self.assertEqual(cfg.jump, new_jump)
        cfg.add_jump("mon")  # accept overlap (overlap with weekday)
        cfg.replace_jump(None)  # . reset jump
        self.assertEqual(cfg.jump, org_jump)

        # Test Pertain
        org_pertain = cfg.pertain
        new_pertain = {"of", "the", "in"}
        cfg.replace_pertain(set())  # . clear pertain
        self.assertFalse(len(cfg.pertain))
        self.assertFalse(cfg.is_pertain("of"))
        cfg.add_pertain("of")  # . add pertain
        self.assertEqual(len(cfg.pertain), 1)
        self.assertTrue(cfg.is_pertain("of"))  # . lowercase
        self.assertTrue(cfg.is_pertain("OF"))  # . uppercase
        self.assertTrue(cfg.is_pertain("Of"))  # . titlecase
        self.assertFalse(cfg.is_pertain("oF"))  # . worng case
        self.assertTrue(cfg.remove_pertain("of"))  # . remove pertain
        self.assertFalse(cfg.is_pertain("of"))
        self.assertFalse(cfg.is_pertain("OF"))
        self.assertFalse(cfg.is_pertain("Of"))
        self.assertFalse(len(cfg.pertain))
        self.assertFalse(cfg.remove_pertain("of"))
        cfg.replace_pertain(new_pertain)  # . replace pertain
        self.assertEqual(cfg.pertain, new_pertain)
        with self.assertRaises(errors.InvalidConfigsToken):
            cfg.add_pertain("mon")  # conflict with weekday
        cfg.replace_pertain(None)  # . reset pertain
        self.assertEqual(cfg.pertain, org_pertain)

        # Test UTC
        org_utc = cfg.utc
        new_utc = {"utc", "z", "gmt"}
        cfg.replace_utc(set())  # . clear utc
        self.assertFalse(len(cfg.utc))
        self.assertFalse(cfg.is_utc("UTC"))
        cfg.add_utc("UTC")  # . add utc
        self.assertEqual(len(cfg.utc), 1)
        self.assertTrue(cfg.is_utc("UTC"))  # . uppercase
        self.assertTrue(cfg.is_utc("utc"))  # . lowercase
        self.assertTrue(cfg.is_utc("Utc"))  # . titlecase
        self.assertFalse(cfg.is_utc("uTC"))  # . worng case
        self.assertTrue(cfg.remove_utc("UTC"))  # . remove utc
        self.assertFalse(cfg.is_utc("UTC"))
        self.assertFalse(cfg.is_utc("utc"))
        self.assertFalse(cfg.is_utc("Utc"))
        self.assertFalse(len(cfg.utc))
        self.assertFalse(cfg.remove_utc("UTC"))
        cfg.replace_utc(new_utc)  # . replace utc
        self.assertEqual(cfg.utc, new_utc)
        with self.assertRaises(errors.InvalidConfigsToken):
            cfg.add_utc("mon")  # conflict with weekday
        cfg.replace_utc(None)  # . reset utc
        self.assertEqual(cfg.utc, org_utc)

        # Test TZ
        org_tz = cfg.tz
        new_tz = {"abc": -5, "def": 3, "xyz": 0}
        cfg.replace_tz(dict())  # . clear tz
        self.assertFalse(len(cfg.tz))
        self.assertFalse(cfg.is_tz("abc"))
        cfg.add_tz("abc", seconds=-5)  # . add tz
        self.assertEqual(len(cfg.tz), 1)
        self.assertTrue(cfg.is_tz("ABC"))  # . uppercase
        self.assertTrue(cfg.is_tz("abc"))  # . lowercase
        self.assertTrue(cfg.is_tz("Abc"))  # . titlecase
        self.assertFalse(cfg.is_tz("aBC"))  # . worng case
        self.assertEqual(cfg.get_tz_offset("ABC"), -5)  # uppercase
        self.assertEqual(cfg.get_tz_offset("abc"), -5)  # lowercase
        self.assertEqual(cfg.get_tz_offset("Abc"), -5)  # titlecase
        self.assertEqual(cfg.get_tz_offset("aBC"), -100_000)  # worng case
        self.assertTrue(cfg.remove_tz("abc"))  # . remove tz
        self.assertFalse(cfg.is_tz("ABC"))
        self.assertFalse(cfg.is_tz("abc"))
        self.assertFalse(cfg.is_tz("Abc"))
        self.assertEqual(cfg.get_tz_offset("ABC"), -100_000)
        self.assertEqual(cfg.get_tz_offset("abc"), -100_000)
        self.assertEqual(cfg.get_tz_offset("Abc"), -100_000)
        self.assertFalse(len(cfg.tz))
        self.assertFalse(cfg.remove_tz("abc"))
        cfg.replace_tz(new_tz)  # . replace tz
        self.assertEqual(cfg.tz, new_tz)
        with self.assertRaises(errors.InvalidConfigsToken):
            cfg.add_tz("mon", 1)  # conflict with weekday
        with self.assertRaises(errors.InvalidConfigsValue):
            cfg.add_tz("efg", hours=-25)  # invalid offset
        cfg.replace_tz(None)  # . reset tz
        self.assertEqual(cfg.tz, org_tz)

        # Test month
        org_month = cfg.month
        new_month = {"jan": 1, "feb": 2, "mar": 3}
        cfg.replace_month(dict())  # . clear month
        self.assertFalse(len(cfg.month))
        self.assertFalse(cfg.is_month("jan"))
        cfg.add_month("jan", 1)  # . add month
        self.assertEqual(len(cfg.month), 1)
        self.assertTrue(cfg.is_month("JAN"))  # . uppercase
        self.assertTrue(cfg.is_month("jan"))  # . lowercase
        self.assertTrue(cfg.is_month("Jan"))  # . titlecase
        self.assertFalse(cfg.is_month("jAN"))  # . worng case
        self.assertEqual(cfg.get_month("JAN"), 1)  # uppercase
        self.assertEqual(cfg.get_month("jan"), 1)  # lowercase
        self.assertEqual(cfg.get_month("Jan"), 1)  # titlecase
        self.assertEqual(cfg.get_month("jAN"), -1)  # worng case
        self.assertTrue(cfg.remove_month("jan"))  # . remove month
        self.assertFalse(cfg.is_month("JAN"))
        self.assertFalse(cfg.is_month("jan"))
        self.assertFalse(cfg.is_month("Jan"))
        self.assertEqual(cfg.get_month("JAN"), -1)
        self.assertEqual(cfg.get_month("jan"), -1)
        self.assertEqual(cfg.get_month("Jan"), -1)
        self.assertFalse(len(cfg.month))
        self.assertFalse(cfg.remove_month("jan"))
        cfg.replace_month(new_month)  # . replace month
        self.assertEqual(cfg.month, new_month)
        with self.assertRaises(errors.InvalidConfigsToken):
            cfg.add_month("mon", 1)  # conflict with weekday
        with self.assertRaises(errors.InvalidConfigsValue):
            cfg.add_month("efg", 13)  # invalid month number
        cfg.replace_month(None)  # . reset month
        self.assertEqual(cfg.month, org_month)

        # Test weekday
        org_weekday = cfg.weekday
        new_weekday = {"mon": 0, "tue": 1, "wed": 2}
        cfg.replace_weekday(dict())  # . clear weekday
        self.assertFalse(len(cfg.weekday))
        self.assertFalse(cfg.is_weekday("mon"))
        cfg.add_weekday("mon", 0)  # . add weekday
        self.assertEqual(len(cfg.weekday), 1)
        self.assertTrue(cfg.is_weekday("MON"))  # . uppercase
        self.assertTrue(cfg.is_weekday("mon"))  # . lowercase
        self.assertTrue(cfg.is_weekday("Mon"))  # . titlecase
        self.assertFalse(cfg.is_weekday("mON"))  # . worng case
        self.assertEqual(cfg.get_weekday("MON"), 0)  # uppercase
        self.assertEqual(cfg.get_weekday("mon"), 0)  # lowercase
        self.assertEqual(cfg.get_weekday("Mon"), 0)  # titlecase
        self.assertEqual(cfg.get_weekday("mON"), -1)  # worng case
        self.assertTrue(cfg.remove_weekday("mon"))  # . remove weekday
        self.assertFalse(cfg.is_weekday("MON"))
        self.assertFalse(cfg.is_weekday("mon"))
        self.assertFalse(cfg.is_weekday("Mon"))
        self.assertEqual(cfg.get_weekday("MON"), -1)
        self.assertEqual(cfg.get_weekday("mon"), -1)
        self.assertEqual(cfg.get_weekday("Mon"), -1)
        self.assertFalse(len(cfg.weekday))
        self.assertFalse(cfg.remove_weekday("mon"))
        cfg.replace_weekday(new_weekday)  # . replace weekday
        self.assertEqual(cfg.weekday, new_weekday)
        with self.assertRaises(errors.InvalidConfigsToken):
            cfg.add_weekday("jan", 1)  # conflict with month
        with self.assertRaises(errors.InvalidConfigsValue):
            cfg.add_weekday("efg", 7)  # invalid weekday number
        cfg.replace_weekday(None)  # . reset weekday
        self.assertEqual(cfg.weekday, org_weekday)

        # Test hms
        org_hms = cfg.hms
        new_hms = {"hour": 0, "minute": 1}
        cfg.replace_hms(dict())  # . clear hms
        self.assertFalse(len(cfg.hms))
        self.assertFalse(cfg.is_hms("hour"))
        cfg.add_hms("hour", 0)  # . add hms
        self.assertEqual(len(cfg.hms), 1)
        self.assertTrue(cfg.is_hms("HOUR"))  # . uppercase
        self.assertTrue(cfg.is_hms("hour"))  # . lowercase
        self.assertTrue(cfg.is_hms("Hour"))  # . titlecase
        self.assertFalse(cfg.is_hms("hOUR"))  # . worng case
        self.assertEqual(cfg.get_hms("HOUR"), 0)  # uppercase
        self.assertEqual(cfg.get_hms("hour"), 0)  # lowercase
        self.assertEqual(cfg.get_hms("Hour"), 0)  # titlecase
        self.assertEqual(cfg.get_hms("hOUR"), -1)  # worng case
        self.assertTrue(cfg.remove_hms("hour"))  # . remove hms
        self.assertFalse(cfg.is_hms("HOUR"))
        self.assertFalse(cfg.is_hms("hour"))
        self.assertFalse(cfg.is_hms("Hour"))
        self.assertEqual(cfg.get_hms("HOUR"), -1)
        self.assertEqual(cfg.get_hms("hour"), -1)
        self.assertEqual(cfg.get_hms("Hour"), -1)
        self.assertFalse(len(cfg.hms))
        self.assertFalse(cfg.remove_hms("hour"))
        cfg.replace_hms(new_hms)  # . replace hms
        self.assertEqual(cfg.hms, new_hms)
        with self.assertRaises(errors.InvalidConfigsToken):
            cfg.add_hms("mon", 1)  # conflict with weekday
        with self.assertRaises(errors.InvalidConfigsValue):
            cfg.add_hms("efg", 3)  # invalid hms flag
        cfg.replace_hms(None)  # . reset hms
        self.assertEqual(cfg.hms, org_hms)

        # Test ampm
        org_ampm = cfg.ampm
        new_ampm = {"am": 0, "pm": 1}
        cfg.replace_ampm(dict())  # . clear ampm
        self.assertFalse(len(cfg.ampm))
        self.assertFalse(cfg.is_ampm("am"))
        cfg.add_ampm("am", 0)  # . add ampm
        self.assertEqual(len(cfg.ampm), 1)
        self.assertTrue(cfg.is_ampm("AM"))  # . uppercase
        self.assertTrue(cfg.is_ampm("am"))  # . lowercase
        self.assertTrue(cfg.is_ampm("Am"))  # . titlecase
        self.assertFalse(cfg.is_ampm("aM"))  # . worng case
        self.assertEqual(cfg.get_ampm("AM"), 0)  # uppercase
        self.assertEqual(cfg.get_ampm("am"), 0)  # lowercase
        self.assertEqual(cfg.get_ampm("Am"), 0)  # titlecase
        self.assertEqual(cfg.get_ampm("aM"), -1)  # worng case
        self.assertTrue(cfg.remove_ampm("am"))  # . remove ampm
        self.assertFalse(cfg.is_ampm("AM"))
        self.assertFalse(cfg.is_ampm("am"))
        self.assertFalse(cfg.is_ampm("Am"))
        self.assertEqual(cfg.get_ampm("AM"), -1)
        self.assertEqual(cfg.get_ampm("am"), -1)
        self.assertEqual(cfg.get_ampm("Am"), -1)
        self.assertFalse(len(cfg.ampm))
        self.assertFalse(cfg.remove_ampm("am"))
        cfg.replace_ampm(new_ampm)  # . replace ampm
        self.assertEqual(cfg.ampm, new_ampm)
        with self.assertRaises(errors.InvalidConfigsToken):
            cfg.add_ampm("mon", 1)  # conflict with weekday
        with self.assertRaises(errors.InvalidConfigsValue):
            cfg.add_ampm("efg", 2)  # invalid ampm flag
        cfg.replace_ampm(None)  # . reset ampm
        self.assertEqual(cfg.ampm, org_ampm)

        # Test import from parserinfo
        with self.assertRaises(errors.InvalidParserInfo):
            cfg = Configs.from_parserinfo("xxx")  # Invalid type
        info = parserinfo()
        info.JUMP = {"and", None}
        with self.assertRaises(errors.InvalidConfigsToken):
            cfg = Configs.from_parserinfo(info)  # Invalid jump value

        # Proper import
        cfg = Configs.from_parserinfo(parserinfo())

        # Print default configs
        cfg.reset_settings()
        print(cfg)
        self.log_ended(test)

    def test_timelex(self, rounds: int) -> None:
        from timeit import timeit
        from cytimes.parser import timelex
        from dateutil.parser._parser import _timelex

        def remove_spaces(dtstr: str) -> str:
            res = ""
            previous_was_space = False
            for ch in dtstr:
                if ch == " ":
                    if not previous_was_space:
                        res += ch
                    previous_was_space = True
                else:
                    res += ch
                    previous_was_space = False
            if res[-1] == " ":
                res = res[:-1]
            return res

        def perform_timelex_python() -> None:
            for dts in self.dts:
                list(_timelex(dts[0]))

        def perform_timelex_cytimes() -> None:
            for dts in self.dts:
                timelex(dts[0])

        test = "Timelex"
        self.log_start(test)
        # cytimes.timelex removes extra spaces between tokens
        # so we need to normalize the inputs for comparison
        normalized_dts = [remove_spaces(i) for i, _, _ in self.dts]

        for i, dts in enumerate(self.dts):
            dt = dts[0]
            cmp = list(_timelex(normalized_dts[i]))
            while cmp[0] == " ":
                cmp.pop(0)
            val = timelex(dt)
            self.assertEqual(cmp, val, f"{repr(dt)}:\n{cmp}\n{val}")

        t1 = timeit(lambda: perform_timelex_python(), number=rounds)
        print(f"Timelex dateutil: {t1:.4f} seconds for {rounds} rounds")
        t2 = timeit(lambda: perform_timelex_cytimes(), number=rounds)
        print(f"Timelex Cytimes : {t2:.4f} seconds for {rounds} rounds")
        print(f"Speedup         : {t1 / t2:.2f}x")

        self.log_ended(test)

    def test_parser(
        self,
        rounds: int,
        isoformat: bool = True,
        ignoretz: bool = True,
    ) -> None:
        from cytimes.parser import Configs, Parser

        test = (
            f"Parser | rounds: {rounds} | isoformat: {isoformat} | ignoretz: {ignoretz}"
        )
        self.log_start(test)

        # Setup
        cfg = Configs()
        cfg.add_tz("AKDT", -8)
        cfg.add_tz("AKST", -9)
        cfg.add_tz("EST", -5)
        cfg.add_tz("HST", -10)
        cfg.add_tz("MST", -7)
        cfg.add_tz("PST", -8)
        cfg.add_tz("CDT", -5)
        cfg.add_tz("EDT", -4)
        cfg.add_tz("MDT", -6)
        cfg.add_tz("PDT", -7)
        parser = Parser(cfg=cfg)
        default = datetime.date(1, 1, 1)

        for dtstr, base_no_tz, base_tz in self.dts:
            res = parser.parse(
                dtstr,
                default=default,
                year1st=False,
                ignoretz=ignoretz,
                isoformat=isoformat,
            )
            cmp = base_no_tz if ignoretz else base_tz
            assert cmp == str(res), "%r:\nBase:\t%r\nParse:\t%r" % (
                dtstr,
                cmp,
                str(res),
            )

        for _ in range(rounds):
            for dtstr, _, _ in self.dts:
                parser.parse(
                    dtstr,
                    default=default,
                    year1st=False,
                    ignoretz=ignoretz,
                    isoformat=isoformat,
                )

        self.log_ended(test)

    def test_parse_function(self) -> None:
        from pandas import Timestamp
        from pendulum import DateTime
        from cytimes.parser import parse, Configs

        test = "Test 'parse' function"
        self.log_start(test)

        dtstr = "August 2, 2023 12:01 UTC"
        res = parse(dtstr, dtclass=Timestamp)
        self.assertIsInstance(res, Timestamp)
        res = parse(dtstr, dtclass=Timestamp, ignoretz=False)
        self.assertIsInstance(res, Timestamp)
        res = parse(dtstr, dtclass=DateTime)
        self.assertIsInstance(res, DateTime)
        res = parse(dtstr, dtclass=DateTime, ignoretz=False)
        self.assertIsInstance(res, DateTime)

        with self.assertRaises(errors.ParserFailedError):
            parse(dtstr, dtclass=datetime.date)
        with self.assertRaises(errors.ParserFailedError):
            parse(dtstr, dtclass=int)

        cfg = Configs()
        cfg.add_tz("AKDT", -8)
        cfg.add_tz("AKST", -9)
        cfg.add_tz("EST", -5)
        cfg.add_tz("HST", -10)
        cfg.add_tz("MST", -7)
        cfg.add_tz("PST", -8)
        cfg.add_tz("CDT", -5)
        cfg.add_tz("EDT", -4)
        cfg.add_tz("MDT", -6)
        cfg.add_tz("PDT", -7)
        default = datetime.date(1, 1, 1)

        for dtstr, base_no_tz, base_tz in self.dts:
            # fmt: off
            # Isoformat=True & ignoretz=True
            res = parse(dtstr, default=default, year1st=False, cfg=cfg, isoformat=True, ignoretz=True)
            assert base_no_tz == str(res), "%r:\nBase:\t%r\nParse:\t%r" % (dtstr, base_no_tz, str(res))

            # Isoformat=True & ignoretz=False
            res = parse(dtstr, default=default, year1st=False, cfg=cfg, isoformat=True, ignoretz=False)
            assert base_tz == str(res), "%r:\nBase:\t%r\nParse:\t%r" % (dtstr, base_tz, str(res))

            # Isoformat=False & ignoretz=True
            res = parse(dtstr, default=default, year1st=False, cfg=cfg, isoformat=False, ignoretz=True)
            assert base_no_tz == str(res), "%r:\nBase:\t%r\nParse:\t%r" % (dtstr, base_no_tz, str(res))

            # Isoformat=False & ignoretz=False
            res = parse(dtstr, default=default, year1st=False, cfg=cfg, isoformat=False, ignoretz=False)
            assert base_tz == str(res), "%r:\nBase:\t%r\nParse:\t%r" % (dtstr, base_tz, str(res))

            # No cfg: Isoformat=True & ignoretz=True
            res = parse(dtstr, default=default, year1st=False, isoformat=True, ignoretz=True)
            assert base_no_tz == str(res), "%r:\nBase:\t%r\nParse:\t%r" % (dtstr, base_no_tz, str(res))

            # No cfg: Isoformat=False & ignoretz=True
            res = parse(dtstr, default=default, year1st=False, isoformat=False, ignoretz=True)
            assert base_no_tz == str(res), "%r:\nBase:\t%r\nParse:\t%r" % (dtstr, base_no_tz, str(res))
            # fmt: on

        self.log_ended(test)

    def test_parse_obj_function(self) -> None:
        import numpy as np
        from pandas import Timestamp
        from cytimes.parser import parse_obj

        test = "Test 'parse_obj' function"
        self.log_start(test)

        dtstr = "2000-08-02"
        dt = datetime.datetime(2000, 8, 2)

        # Single string
        res = parse_obj(dtstr)
        self.assertIs(type(res), datetime.datetime)
        self.assertEqual(res, dt)
        res = parse_obj(dtstr, dtclass=Timestamp)
        self.assertIs(type(res), Timestamp)
        self.assertEqual(res, dt)

        # Datetime
        res = parse_obj(dt)
        self.assertIs(type(res), datetime.datetime)
        self.assertEqual(res, dt)
        res = parse_obj(dt, dtclass=Timestamp)
        self.assertIs(type(res), Timestamp)
        self.assertEqual(res, dt)

        # Date
        date = datetime.date(2000, 8, 2)
        res = parse_obj(date)
        self.assertIs(type(res), datetime.datetime)
        self.assertEqual(res, dt)
        res = parse_obj(date, dtclass=Timestamp)
        self.assertIs(type(res), Timestamp)
        self.assertEqual(res, dt)

        # Integer
        res = parse_obj(1)
        self.assertIs(type(res), datetime.datetime)
        self.assertEqual(res, datetime.datetime(1970, 1, 1, 0, 0, 1))
        res = parse_obj(1, dtclass=Timestamp)
        self.assertIs(type(res), Timestamp)
        self.assertEqual(res, datetime.datetime(1970, 1, 1, 0, 0, 1))

        # Float
        res = parse_obj(1.1)
        self.assertIs(type(res), datetime.datetime)
        self.assertEqual(res, datetime.datetime(1970, 1, 1, 0, 0, 1, 100000))
        res = parse_obj(1.1, dtclass=Timestamp)
        self.assertIs(type(res), Timestamp)
        self.assertEqual(res, datetime.datetime(1970, 1, 1, 0, 0, 1, 100000))

        # Numpy datetime64
        np_dt64 = np.datetime64("2000-08-02T00:00:00.123456789")
        res = parse_obj(np_dt64)
        self.assertIs(type(res), datetime.datetime)
        self.assertEqual(res, datetime.datetime(2000, 8, 2, 0, 0, 0, 123456))
        res = parse_obj(np_dt64, dtclass=Timestamp)
        self.assertIs(type(res), Timestamp)
        self.assertEqual(res, datetime.datetime(2000, 8, 2, 0, 0, 0, 123456))

        self.log_ended(test)


if __name__ == "__main__":
    TestParser().test_all(100)
